title,director,cast,country,date_added,release_year,rating,listed_in,description,duration_in_minutes
ATM,"Mez Tharatorn","Chantavit Dhanasevi, Preechaya Pongthananikorn, Chaleumpol Tikumpornteerawong, Thawat Pornrattanaprasert, Sananthachat Thanapatpisal, Pongkool Suebsung, Puttachat Pongsuchat, Gornpop Janjaroen, Yanee Tramoth, Pongsatorn Jongwilak","United States, Canada","2018-09-05 00:00:00",2012,TV-14,"Comedies, International Movies, Romantic Movies","When a broken ATM dishes out a fortune, a couple who works at the bank vies to see who can recover the most cash – and the loser must find a new job.",122
"Attacking the Devil: Harold Evans and the Last Nazi War Crime","David Morris, Jacqui Morris","Harold Evans","United Kingdom","2016-05-15 00:00:00",2014,TV-14,"Documentaries, International Movies","Intrepid newspaper editor Harold Evans wages an ongoing battle to expose the truth about a dangerous drug and obtain compensation for its victims.",102
"Attitude Test","Fabrizio Copano, Augusto Matte","Belén Soto, Denise Rosenthal, Constanza Piccoli, Fabiola Alarcón, Lucas Balmaceda, Agustín Silva, Camilo Carmona, Ingrid Cruz, Elvis Fuentes, Samuel Landea",Chile,"2018-08-19 00:00:00",2016,TV-14,"Comedies, Independent Movies, International Movies","Four high school seniors steal an important college entrance exam and go on vacation to "study," but accidentally lose the exam while partying.",88
"Audrie & Daisy","Bonni Cohen, Jon Shenk",NULL,"United States","2016-09-23 00:00:00",2016,TV-MA,Documentaries,"In this wrenching documentary, two teens are sexually assaulted by boys they considered friends, humiliated online and harassed by their communities.",99
Aurora,"Cristi Puiu","Cristi Puiu, Clara Voda, Catrinel Dumitrescu, Luminita Gheorghiu, Valentin Popescu, Gheorghe Ifrim, Ileana Puiu, Valeria Seciu, Gelu Colceag","Romania, France, Switzerland, Germany","2020-03-04 00:00:00",2010,TV-MA,"Dramas, International Movies","42-year-old Viorel, a distraught engineer, takes drastic measures to end his emotional suffering after enduring a devastating divorce.",186
"Auschwitz: Blueprints of Genocide","Mike Rossiter","Roy Marsden","United Kingdom","2019-01-19 00:00:00",1994,TV-PG,Documentaries,"Newly released KGB files expose evidence proving how architects and engineers conspired with the Nazis to build a camp designed for genocide.",49
"Austin Powers in Goldmember","Jay Roach","Mike Myers, Beyoncé Knowles-Carter, Seth Green, Michael York, Robert Wagner, Mindy Sterling, Verne Troyer, Michael Caine, Fred Savage","United States","2019-12-01 00:00:00",2002,PG-13,"Action & Adventure, Comedies","The world's most shagadelic spy continues his fight against the diabolical Dr. Evil, who's teamed with a new foe: 1970s villain Goldmember.",94
"Austin Powers: International Man of Mystery","Jay Roach","Mike Myers, Elizabeth Hurley, Michael York, Mimi Rogers, Robert Wagner, Seth Green, Fabiana Udenio, Mindy Sterling, Paul Dillon, Charles Napier, Will Ferrell","United States","2019-12-01 00:00:00",1997,PG-13,Comedies,"A swingin' fashion photographer by day and a groovy British secret agent by night, superspy Austin Powers must foil the sinister schemes of Dr. Evil.",90
"Austin Powers: The Spy Who Shagged Me","Jay Roach","Mike Myers, Heather Graham, Michael York, Robert Wagner, Rob Lowe, Seth Green, Mindy Sterling, Verne Troyer, Elizabeth Hurley, Will Ferrell","United States","2019-12-01 00:00:00",1999,PG-13,"Action & Adventure, Comedies, Sci-Fi & Fantasy","When diabolical genius Dr. Evil travels back in time to steal superspy Austin Powers's "mojo," Austin must return to the swingin' '60s himself.",95
Autohead,"Rohit Mittal","Deepak Sampat, Ronjini Chakroborty, Vikrant Singh, Jhanvi Dwivedi, Ajay Mishra, Rohit Mittal, Sunny Banerjee, Ravidev Singh",India,"2017-01-01 00:00:00",2016,TV-MA,"Dramas, International Movies, Thrillers","A production crew that thinks it's making a documentary about a humble Mumbai rickshaw driver unmasks a horrifying truth about their film's subject.",97
Automata,"Gabe Ibáñez","Antonio Banderas, Dylan McDermott, Melanie Griffith, Birgitte Hjort Sørensen, Robert Forster, Christa Campbell, Tim McInnerny, Andy Nyman, David Ryall","Bulgaria, United States, Spain, Canada","2017-09-08 00:00:00",2014,R,"International Movies, Sci-Fi & Fantasy, Thrillers","In a dystopian future, an insurance adjuster for a tech company investigates a robot killed for violating protocol and discovers a global conspiracy.",110
Ava,"Tate Taylor","Jessica Chastain, Colin Farrell, John Malkovich, Common, Geena Davis, Jess Weixler, Diana Silvers, Joan Chen, Ioan Gruffudd","United States","2020-12-07 00:00:00",2020,R,"Action & Adventure, Dramas","An elite assassin wrestling with doubts about her work scrambles to protect herself — and her estranged family — after a hit goes dangerously wrong.",97
"Ave Maryam","Ertanto Robby Soediskam","Maudy Koesnaedi, Chicco Jerikho, Tutie Kirana, Olga Lydia, Joko Anwar, Nathania Angela Widjaja, Sendy Febrina, Suhartini, Atie Krisnawati, Ratnawati Sutandar, Ninik Winarni Utomo",Indonesia,"2020-09-03 00:00:00",2018,TV-PG,"Dramas, International Movies, Romantic Movies","A devoted nun who cares for her elder sisters must choose between upholding her vows or pursuing her forbidden feelings for a fascinating pastor.",73
Avengement,"Jesse V. Johnson","Scott Adkins, Craig Fairbrass, Thomas Turgoose, Nick Moran, Kierston Wareing, Mark Strange, Leo Gregory, Luke LaFontaine, Beau Fowler, Dan Styles","United Kingdom","2019-09-17 00:00:00",2019,TV-MA,"Action & Adventure","Betrayed by his loan shark brother, a hardened convict escapes from prison while on furlough to exact revenge against the people who made him a killer.",88
"Avengers: Infinity War","Anthony Russo, Joe Russo","Robert Downey Jr., Josh Brolin, Mark Ruffalo, Tom Hiddleston, Chris Evans, Chris Hemsworth, Jeremy Renner, Chris Pratt, Elizabeth Olsen, Sebastian Stan, Benedict Cumberbatch, Paul Bettany, Cobie Smulders, Benedict Wong, Zoe Saldana, Karen Gillan, Vin Diesel, Dave Bautista, Bradley Cooper, Pom Klementieff, Scarlett Johansson, Benicio Del Toro, Anthony Mackie, Chadwick Boseman, Danai Gurira, Paul Rudd, Don Cheadle, Tom Holland","United States","2018-12-25 00:00:00",2018,PG-13,"Action & Adventure, Sci-Fi & Fantasy","Superheroes amass to stop intergalactic sociopath Thanos from acquiring a full set of Infinity Stones and wiping out half of all life in the universe.",150
"Avicii: True Stories","Levan Tsikurishvili",Avicii,"Sweden, Netherlands","2018-12-28 00:00:00",2017,TV-MA,"Documentaries, International Movies, Music & Musicals","Follow the meteoric rise of Tim Bergling, aka Avicii, from Swedish teenager to the creative force behind "Wake Me Up," "You Make Me" and other hits.",97
"Await Further Instructions","Johnny Kevorkian","Sam Gittins, Grant Masters, Neerja Naik, Abigail Cruttenden, Kris Saddler, Holly Weston, David Bradley","United Kingdom","2019-02-02 00:00:00",2018,TV-MA,"Horror Movies, Sci-Fi & Fantasy","A family’s tense reunion turns terrifying when they get trapped in their home by an unknown force, and sinister commands begin appearing on their TV.",91
Awake,"Aleksandr Chernyaev, Fedor Lyass","Jonathan Rhys Meyers, Francesca Eastwood, Malik Yoba, William Forsythe, James Austin Kerr, Jeremy Parr","United States","2019-11-24 00:00:00",2019,TV-MA,Thrillers,"After an accident leaves him with no recollection of who he is, a man becomes a prime suspect in the search for a serial killer targeting young women.",92
Awe,"Prasanth Varma","Kajal Aggarwal, Nithya Menon, Regina Cassandra, Eesha Rebba, Murli Sharma, Srinivas Avasarala, Priyadarshi Pullikonda",India,"2019-02-15 00:00:00",2018,TV-MA,"Dramas, International Movies, Sci-Fi & Fantasy","Disparate characters, including an aspiring time traveler, a phony chef, a drug-addicted waitress and several others, share a surprising connection.",111
Axone,"Nicholas Kharkongor","Sayani Gupta, Lin Laishram, Tenzing Dalha, Dolly Ahluwalia, Vinay Pathak, Lanuakam Ao, Rohan Joshi, Adil Hussain, Asenla Jamir",India,"2020-06-12 00:00:00",2020,TV-MA,"Comedies, Dramas, Independent Movies","In Delhi, friends from Northeast India prepare a pungent delicacy for a wedding party, sparking conflict and comedy with their unaccustomed neighbors.",101
Ayana,"Gangadhar Salimath","Deepak Subramanya, Apoorva Soma, Ramesh Bhat, Harsha H S, Karthik A, Goutham Shashidhar, Nagshree Karkone, Moksha Kushal, Vedashree Rao",India,"2019-02-15 00:00:00",2017,TV-MA,"Dramas, International Movies","With his carefree bachelor days behind him, a young entrepreneur’s ambitions for adulthood come with some painful personal and professional decisions.",112
"Ayotzinapa, el paso de la tortuga","Enrique García Meza",NULL,Mexico,"2018-12-01 00:00:00",2018,TV-MA,"Documentaries, International Movies","Delving into the disappearance of 43 college students in Mexico, this documentary seeks to give justice and a voice to the victims and their families.",73
Azali,"Kwabena Gyansah","Ama K. Abebrese, Asana Alhassan, Adjetey Anang, Akofa Edjeani Asiedu, Emmanuel Nii Adom Quaye, Peter Ritchie",Ghana,"2020-02-07 00:00:00",2018,TV-14,"Dramas, International Movies","Sent away to evade an arranged marriage, a 14-year-old begins a harrowing journey of sex work and poverty in the slums of Accra.",89
Azhar,"Anthony D'Souza","Emraan Hashmi, Prachi Desai, Nargis Fakhri, Lara Dutta, Kunaal Roy Kapur, Gautam Gulati, Anikie Maguire, Kulbhushan Kharbanda, Rajesh Sharma, Shernaz Patel, Veerendra Saxena",India,"2019-04-12 00:00:00",2016,TV-14,"Dramas, International Movies, Sports Movies","This biopic traces the tumultuous life and career of top cricket player Mohammad Azharuddin, who led India's national team in the 1990s.",129
"Aziz Ansari Live at Madison Square Garden","Aziz Ansari","Aziz Ansari","United States","2015-03-06 00:00:00",2015,TV-MA,"Stand-Up Comedy","Stand-up comedian and TV star Aziz Ansari ("Parks and Recreation") delivers his sharp-witted take on immigrants, relationships and the food industry.",58
"Aziz Ansari: Buried Alive","Will Lovelace, Dylan Southern","Aziz Ansari","United States","2013-11-01 00:00:00",2013,TV-MA,"Stand-Up Comedy",""Parks and Recreation" star Aziz Ansari takes the stage to share his unfiltered views on adulthood, babies, marriage, love and more in the modern era.",80
"Aziz Ansari: RIGHT NOW","Spike Jonze","Aziz Ansari","United States","2019-07-09 00:00:00",2019,TV-MA,"Stand-Up Comedy","In a comedy special directed by Spike Jonze, Aziz Ansari shares deep personal insights and hilarious takes on wokeness, family and the social climate.",65
"B.A. Pass","Ajay Bahl","Shadab Kamal, Shilpa Shukla, Rajesh Sharma, Dibyendu Bhattacharya, Vijay Kaushik, Anula Navlekar, Happy Ranjit, Raveena Singh, Padam Mishra",India,"2018-06-07 00:00:00",2013,TV-14,"Dramas, Independent Movies, International Movies","Orphaned and at loose ends, young Mukesh falls into the seductive orbit of married Sarika, who leads him ever deeper into a world of sex and betrayal.",99
"B.A. Pass 2","Shadab Khan","Kritika Sachdeva, Sasho, Sanghmitra Hitaishi, Indraneil Sengupta, Saurabh Dubey, Shubhangi Latkar, Sukhbir Kaur Lamba, Arav Chowdharry",India,"2018-06-01 00:00:00",2017,TV-14,"Dramas, International Movies","A young woman eager to avoid an arranged marriage moves to Mumbai, where she learns hard truths about show business, life and love.",126
Baadshaho,"Milan Luthria","Ajay Devgn, Emraan Hashmi, Vidyut Jamwal, Ileana D'Cruz, Esha Gupta, Sanjay Mishra, Sunny Leone, Sharad Kelkar, Priyanshu Chatterjee, Denzil Smith",India,"2017-10-16 00:00:00",2017,TV-14,"Action & Adventure, International Movies","In 1975, during the government-declared Emergency, thief Bhawani and his crew plan a daring robbery to reclaim his royal lover's seized treasures.",135
Baaghi,"Sabir Khan","Tiger Shroff, Shraddha Kapoor, Sudheer Babu, Paras Arora, Sunil Grover, Sourav Chakraborty, Shaurya Bhardawaj",India,"2018-08-04 00:00:00",2016,TV-14,"Action & Adventure, International Movies","A martial artist faces his biggest test when he has to travel to Bangkok to rescue the woman he loves from the clutches of his romantic rival.",127
"Baahubali 2: The Conclusion (Hindi Version)","S.S. Rajamouli","Prabhas, Rana Daggubati, Anushka Shetty, Tamannaah Bhatia, Sathyaraj, Ramya Krishnan, Nassar, Subbaraju",India,"2017-08-07 00:00:00",2017,TV-MA,"Action & Adventure, Dramas, International Movies","To avenge his father's death, a young man leads an army into battle against a cruel tyrant in this Hindi conclusion to the historic saga.",165
"Baahubali 2: The Conclusion (Malayalam Version)","S.S. Rajamouli","Prabhas, Rana Daggubati, Anushka Shetty, Tamannaah Bhatia, Sathyaraj, Ramya Krishnan, Nassar, Subbaraju",NULL,"2017-08-07 00:00:00",2017,TV-14,"Action & Adventure, Dramas, International Movies","To avenge his father's death, a young man leads an army into battle against a cruel tyrant in this Malayalam conclusion to the historic saga.",166
"Baahubali 2: The Conclusion (Tamil Version)","S.S. Rajamouli","Prabhas, Rana Daggubati, Anushka Shetty, Tamannaah Bhatia, Sathyaraj, Ramya Krishnan, Nassar, Subbaraju",NULL,"2017-08-07 00:00:00",2017,TV-MA,"Action & Adventure, Dramas, International Movies","To avenge his father's death, a young man leads an army into battle against a cruel tyrant in this Tamil conclusion to the historic saga.",166
"Baahubali: The Beginning (English Version)","S.S. Rajamouli","Prabhas, Rana Daggubati, Anushka Shetty, Tamannaah Bhatia, Sathyaraj, Nassar, Ramya Krishnan, Sudeep",NULL,"2018-10-24 00:00:00",2015,TV-14,"Action & Adventure, Dramas, International Movies","Villagers in the kingdom of Mahismati rescue a baby who is destined to embark on a heroic quest in this English version of S.S. Rajamouli's epic.",138
"Baahubali: The Beginning (Hindi Version)","S.S. Rajamouli","Prabhas, Rana Daggubati, Anushka Shetty, Tamannaah Bhatia, Sathyaraj, Nassar, Ramya Krishnan, Sudeep",India,"2017-08-07 00:00:00",2015,TV-14,"Action & Adventure, Dramas, International Movies","Villagers in the kingdom of Mahismati rescue a baby who is destined to embark on a heroic quest in this Hindi version of S.S. Rajamouli's epic.",159
"Baahubali: The Beginning (Malayalam Version)","S.S. Rajamouli","Prabhas, Rana Daggubati, Anushka Shetty, Tamannaah Bhatia, Sathyaraj, Nassar, Ramya Krishnan, Sudeep",NULL,"2017-08-07 00:00:00",2015,TV-14,"Action & Adventure, Dramas, International Movies","Villagers in the kingdom of Mahismati rescue a baby who is destined to embark on a heroic quest in this Malayalam version of S.S. Rajamouli's epic.",160
"Baahubali: The Beginning (Tamil Version)","S.S. Rajamouli","Prabhas, Rana Daggubati, Anushka Shetty, Tamannaah Bhatia, Sathyaraj, Nassar, Ramya Krishnan, Sudeep",NULL,"2017-08-07 00:00:00",2015,TV-14,"Action & Adventure, Dramas, International Movies","Villagers in the kingdom of Mahismati rescue a baby who is destined to embark on a heroic quest in this Tamil version of S.S. Rajamouli's epic.",159
Baazaar,"Gauravv K Chawla","Saif Ali Khan, Chitrangada Singh, Radhika Apte, Rohan Vinod Mehra, Manish Chaudhary, Denzil Smith, Pawan Chopra, Deepak Gheewala, Utkarsh Mazumdar, Danish Hussain",India,"2019-01-13 00:00:00",2018,TV-MA,"Dramas, International Movies","A wide-eyed graduate learns the ugly side of ambition when he joins in the dubious business practices of his idol, a ruthless Mumbai stock tycoon.",136
"Babam ve Oğlum","Çagan Irmak","Çetin Tekindor, Fikret Kuşkan, Hümeyra, Ege Tanman, Şerif Sezer, Yetkin Dikinciler, Binnur Kaya, Mahmut Gökgöz, Nergis Çorakçi, Bilge Sen",Turkey,"2018-04-30 00:00:00",2005,TV-14,"Dramas, International Movies","Following Turkey's bloody coup of 1980, a widowed reporter returns to his Aegean hometown, bringing his son and a last wish for his estranged father.",112
"Babamın Ceketi","Müfit Can Saçıntı","Müfit Can Saçıntı, Mert Turak, Ünal Yeter, Elif Nur Kerkük, Uğur Demirpehlivan, Ayşen Gruda, Erkan Can, Banu Manioğlu",Turkey,"2020-04-17 00:00:00",2018,TV-MA,"Comedies, International Movies","Facing pressure to marry immediately, an unemployed man must find a way to pay for a wedding by any means necessary.",101
Babel,"Alejandro G. Iñárritu","Brad Pitt, Cate Blanchett, Gael García Bernal, Koji Yakusho, Adriana Barraza, Rinko Kikuchi, Said Tarchani, Boubker Ait El Caid, Elle Fanning, Nathan Gamble, Mohamed Akhzam","France, United States, Mexico","2019-01-01 00:00:00",2006,R,"Dramas, Independent Movies","When an American couple vacationing in Morocco falls victim to a random act of violence, a series of events unfolds across four countries.",143
"Baby Dolls","Vijay Kumar Arora","Nirmal Rishi, Sonam Bajwa, Sukhwinder Chahal, Tania, Gurnam Bhullar",India,"2019-12-01 00:00:00",2019,TV-PG,"Comedies, International Movies, Romantic Movies","When two sisters travel from Canada to Punjab to visit their maternal family, they discover an opportunity to mend a broken bond with their grandmother.",127
"Baby Mamas","Stephanie Zwane","Salamina Mosese, Kay Smith, Thembisa Mdoda, Dineo Ranaka, Sthembiso Khoza, Khaya Mthembu, Jonathan Boynton-Lee, Nicholas Nkuna, Donovan Pietersen, Pamela Nomvete","South Africa","2020-03-13 00:00:00",2018,TV-14,"Comedies, Dramas, International Movies","From surprise news to relationship blues, four coworkers in different stages of motherhood unite to support each other in their struggles with men.",98
"Bachelor Girls","Shikha Makan",NULL,India,"2018-03-01 00:00:00",2016,TV-MA,"Documentaries, International Movies","Through intimate interviews, this documentary explores the stigma facing independent women who seek housing in modern Mumbai.",61
"Back and Forth","José Eduardo Belmonte","Ingrid Guimarães, Fábio Assunção, Alice Braga, Rosanne Mulholland, Caroline Abras, João Assunção",Brazil,"2017-01-05 00:00:00",2016,NR,"Comedies, Dramas, International Movies","When their car breaks down en route to São Paulo, a father and son accept a ride from four beautiful telemarketers who are headed there on holiday.",95
"Back of the Net","Louise Alston","Sofia Wylie, Tiarnie Coupland, Trae Robin, Gemma Chua-Tran, Ashleigh Ross, Yasmin Honeychurch, Raj Labade, Christopher Kirby, Melissa Bonne, Kate Box",Australia,"2019-12-21 00:00:00",2019,TV-Y,"Children & Family Movies, Sports Movies","An American science geek ready to spend a summer at sea accidentally ends up at an Australian soccer academy and is forced to kick it with the locals.",86
"Back to School","Rémy Four, Julien War","Ludovik, Jérôme Niel, Nicolas Berno, Johann Dionnet, Caroline Anglade, Joséphine Draï, Pauline Deshons, Marc Riso, Romain Lancry, Nicolas Lumbreras, Claire Tran, Pitcho Womba Konga",NULL,"2019-08-30 00:00:00",2019,TV-MA,"Comedies, International Movies","Eager to flaunt their success in front of old bullies and teenage crushes, two best friends spend a wild night at their middle school reunion.",84
"Back to the 90s","Yanyong Kuruaungkoul","Dan Aaron Ramnarong, Pimchanok Leuwisetpaiboon, Chanintorn Jitpreeda, Chonlakarn Puangnoy, Achita Pramoj Na Ayudhya, Vichuda Pindum, Kriengsak Hrientong, Likit Sittiphun",Thailand,"2019-01-01 00:00:00",2015,TV-14,"Comedies, International Movies, Music & Musicals","When a teenager is transported back to his parents’ high school days, he has the chance to alter the events that led to their unhappy marriage.",111
Backcountry,"Adam MacDonald","Missy Peregrym, Jeff Roop, Eric Balfour, Nicholas Campbell",Canada,"2017-03-30 00:00:00",2014,NR,"Horror Movies, Independent Movies, Thrillers","A weekend hike for urbanites Alex and Jenn takes a dangerous turn when they become lost deep in the remote territory of a menacing bear.",92
"Backdraft 2","Gonzalo López-Gallego","Joe Anderson, William Baldwin, Donald Sutherland, Alisha Bailey, Alastair Mackenzie, Dominic Mafham, Jessamine-Bliss Bell, Martin Hutson, Aaron McCusker, Cyril Nri","United States","2019-05-14 00:00:00",2019,R,"Action & Adventure, Dramas","In this sequel to the 1991 film, a determined fire investigator recruits an imprisoned arsonist to help untangle a web of fire, murder and corruption.",102
Backfire,"Dave Patten","Black Deniro, Byron "Squally" Vinson, Dominic Costa, Nick Ferraro, Peter Ferriero, Jowharah Jones","United States","2019-04-05 00:00:00",2019,TV-MA,"Dramas, Independent Movies, Thrillers","When two would-be robbers accidentally kill a made man, they find themselves on the run from the South Philly Italian mob.",97
Backtrack,"Michael Petroni","Adrien Brody, Sam Neill, Robin McLeavy, Bruce Spence, Jenni Baird, Chloe Bayliss, Anna Lise Phillips, George Shevtsov","Australia, United Kingdom, United Arab Emirates, Canada","2018-12-25 00:00:00",2015,R,"Dramas, Thrillers","Haunted by visions of the dead, psychologist Peter returns home to confront a long-ago trauma. But will the trip exorcise or embolden the ghosts?",90
"Bad Boys","Michael Bay","Will Smith, Martin Lawrence, Téa Leoni, Tchéky Karyo, Theresa Randle, Joe Pantoliano, Emmanuel Xuereb, Michael Imperioli, Nestor Serrano, Julio Oscar Mechoso","United States","2019-10-01 00:00:00",1995,R,"Action & Adventure, Comedies","In this fast-paced actioner, two Miami narcotics cops are hot on the trail of a master crook who has snatched $100 million worth of heroin.",119
"Bad Boys II","Michael Bay","Will Smith, Martin Lawrence, Jordi Mollà, Gabrielle Union, Peter Stormare, Theresa Randle, Joe Pantoliano, Michael Shannon, Jon Seda, Yul Vazquez","United States","2019-10-01 00:00:00",2003,R,"Action & Adventure, Comedies","In this hyperkinetic sequel, a pair of Miami narcotics cops investigate a Cuban drug kingpin's connection to Florida's influx of Ecstasy.",147
"Bad Day for the Cut","Chris Baugh","Nigel O'Neill, Susan Lynch, Józef Pawlowski, Stuart Graham, David Pearse, Brian Milligan, Anna Prochniak, Stella McCusker, Ian McElhinney, Lalor Roddy","United Kingdom","2018-01-18 00:00:00",2017,TV-MA,"Independent Movies, International Movies, Thrillers","A mild-mannered, middle-aged Irish farmer devoted to his mother embarks on a violent quest for revenge when she's murdered in a home invasion.",99
"Bad Genius","Nattawut Poonpiriya","Chutimon Chuengcharoensukying, Chanon Santinatornkul, Teeradon Supapunpinyo, Eisaya Hosuwan, Thaneth Warakulnukroh, Sarinrat Thomas, Ego Mikitas, Pasin Kuansataporn, Sahajak Boonthanakit, Kanjana Vinaipanid",Thailand,"2018-06-01 00:00:00",2017,TV-MA,"Dramas, International Movies, Thrillers","A top student gets pulled into a cheating racket with increasingly higher risks and even higher rewards. But she may lose much more than she gains.",130
"Bad Grandpa .5","Jeff Tremaine","Johnny Knoxville, Jackson Nicoll, Greg Harris, Georgina Cates, Kamber Hejlik, Jill Killington, Madison Davis, George Faughnan, Spike Jonze, Catherine Keener","United States","2021-01-01 00:00:00",2014,TV-MA,Comedies,"The geriatric antics of Irving Zisman continue in this next installment of the Jackass franchise, which features unused footage from the first film.",87
"Bad Match","David Chirchirillo","Jack Cutmore-Scott, Lili Simmons, Brandon Scott, Chase Williamson, Noureen DeWulf, Seth Morris, Christine Donlon, Trent Haaga, Kahyun Kim, Cynthia Rose Hall, Zedrick Restauro, Eric Podnar","Singapore, United States","2018-03-11 00:00:00",2017,TV-MA,Thrillers,"A player who uses the internet to facilitate his womanizing ways is tormented when he spurns a persistent woman who won't take no for an answer.",83
"Bad Rap","Salima Koroma","Jonathan Park, Awkwafina, David Lee, Richard Lee","United States, Canada","2017-08-21 00:00:00",2016,TV-MA,"Documentaries, Music & Musicals","Four young Asian-American rappers strive to achieve success on their own terms in a musical genre that often treats them as outsiders.",83
"Bad Seeds",Kheiron,"Kheiron, Catherine Deneuve, André Dussollier, Louison Blivet, Adil Dehbi, Hakou Benosmane, Youssouff Wague, Mahia Zrouki, Joseph Jovanovic","France, Belgium","2018-12-21 00:00:00",2018,TV-MA,"Comedies, Dramas, International Movies","Troubled by his past, a scam artist who runs a petty racket with his adoptive mom finds redemption while mentoring a group of difficult students.",105
Badha,"Sumitra Bhave, Sunil Sukthankar","Amruta Subhash, Rajesh More, Devika Daftardar, Renuka Daftardar, Uttara Baokar, Jyoti Subhash, Milind Shinde, Sachin Mondkar",India,"2018-01-01 00:00:00",2006,TV-14,"Dramas, International Movies","A young woman who is suspected of practicing black magic and witchcraft is demonized and forced to live apart from her family.",91
Badla,"Sujoy Ghosh","Amitabh Bachchan, Taapsee Pannu, Amrita Singh, Tony Luke, Manav Kaul",India,"2019-08-07 00:00:00",2019,TV-14,"International Movies, Thrillers","When a woman is accused of killing her lover, a renowned lawyer is hired – but the more they try to  untangle the truth, the more convoluted it becomes.",117
Badland,"Justin Lee","Kevin Makely, Bruce Dern, Mira Sorvino, Trace Adkins, Wes Studi, Tony Todd, Jeff Fahey, James Russo, Amanda Wyss","United States","2020-03-26 00:00:00",2019,TV-14,Dramas,"A detective with a license to kill roams the Old West to wrangle Confederate war criminals and meets a pioneer woman who throws his journey off track.",117
Balto,"Simon Wells","Kevin Bacon, Bob Hoskins, Bridget Fonda, Jim Cummings, Phil Collins, Jack Angel, Danny Mann, Robbie Rist","United States","2018-04-01 00:00:00",1995,G,"Children & Family Movies, Dramas","Balto, who is half wolf and half dog, endures the taunts of disapproving humans as he guides a precious cargo of medicine through the Alaskan winter.",78
