title,director,cast,country,date_added,release_year,rating,listed_in,description,duration_in_minutes
Aftershock,"Nicolás López","Eli Roth, Andrea Osvárt, Ariel Levy, Natasha Yarovenko, Nicolás Martínez, Lorenza Izzo, Marcial Tagle, Ramón Llao, Ignacia Allamand, Paz Bascuñán","United States, Chile","2018-03-07 00:00:00",2012,R,"Action & Adventure, Horror Movies","An American tourist and his friends are partying in Chile, but a major earthquake devastates the area and forces them to scramble for survival.",89
"Agatha and the Truth of Murder","Terry Loane","Ruth Bradley, Pippa Haywood, Dean Andrews, Bebe Cave, Blake Harrison, Tim McInnerny, Ralph Ineson, Michael McElhatton","United Kingdom","2019-01-31 00:00:00",2018,TV-MA,Dramas,"In a dramatized depiction of her 11-day disappearance, novelist Agatha Christie solving a real murder amid a crisis in her writing and marriage.",92
"Aggretsuko: We Wish You a Metal Christmas",Rarecho,"Kaolip, Shingo Kato, Komegumi Koiwasaki, Maki Tsuruta, Sohta Arai, Rina Inoue, Yuki Takahashi, Rarecho",Japan,"2018-12-20 00:00:00",2018,TV-PG,Movies,"While Retsuko desperately makes plans for Christmas Eve, her new obsession with seeking validation through social media spirals out of control.",22
Agneepath,"Mukul Anand","Amitabh Bachchan, Mithun Chakraborty, Danny Denzongpa, Madhavi, Neelam, Alok Nath, Rohini Hattangadi, Tinnu Anand, Vikram Gokhale, Archana Puran Singh",India,"2020-04-01 00:00:00",1990,TV-14,"Dramas, International Movies","A boy grows up to become a gangster in pursuit of the mobster who killed his innocent father, but revenge and reparation may come at great costs.",174
"Agustín Aristarán: Soy Rada","Mariano Baez","Agustín Aristarán",Argentina,"2018-02-16 00:00:00",2018,TV-MA,"Stand-Up Comedy","Argentine comedian Agustín "Radagast" Aristarán adds doses of magic, music and acting to his high-energy stand-up routine.",60
Agyaat,"Ram Gopal Varma","Adesh Bhardwaj, Rasika Dugal, Joy Fernandes, Ravi Kale, Ishtiyak Khan, Priyanka Kothari, Kali Prasad Mukherjee, Nitin Reddy, Gautam Rode, Howard Rosemeyer",India,"2018-10-01 00:00:00",2009,TV-14,"Horror Movies, International Movies","A film crew shooting in a remote forested location begins losing members one by one to a mysterious entity that they cannot see or hear.",97
"Ahista Ahista","Shivam Nair","Abhay Deol, Soha Ali Khan, Shayan Munshi, Kamini Khanna, Sohrab Ardeshir, Murad Ali, Shakeel Khan, Natasha Sinha, Brijendra Kala",India,"2019-12-31 00:00:00",2006,TV-14,"Dramas, International Movies, Romantic Movies","Stood up by her groom at the altar, a young woman finds help and healing from another man – until her ex-fiancé returns, hoping to win her back.",122
"Ai Weiwei: Never Sorry","Alison Klayman","Ai Weiwei, Lao Ai","United States","2018-03-01 00:00:00",2012,R,Documentaries,"Chinese artist and activist Ai Weiwei uses social media and art to inspire protests and suffers government persecution for his actions.",91
"Ainu Mosir","Takeshi Fukunaga","Kanto Shimokura, Debo Akibe, Emi Shimokura, Toko Miura, Lily Franky","United States, Japan","2020-11-17 00:00:00",2020,TV-PG,"Dramas, International Movies","A sensitive Ainu teen searches for a spiritual connection with his recently deceased dad while navigating his indigenous identity in a changing world.",84
"Airplane Mode","César Rodrigues","Larissa Manoela, André Luiz Frambach, Erasmo Carlos, Mariana Amâncio, Amanda Orestes, Eike Duarte, Nayobe Nzainab, Katiuscia Canoro, Phellyx Moura, Dani Ornellas, Michel Bercovitch, Sílvia Lourenço","United States","2020-01-23 00:00:00",2020,TV-PG,"Comedies, International Movies, Romantic Movies","When Ana, an influencer, crashes her car while talking on the phone, she’s shipped to her grumpy grandfather's farm – and forced into a digital detox.",97
"Aisa Yeh Jahaan","Biswajeet Bora","Palash Sen, Ira Dubey, Yashpal Sharma, Tinnu Anand, Prisha Dabbas, Kymsleen Kholie, Satish Sharma",India,"2017-10-15 00:00:00",2015,TV-14,"Dramas, Independent Movies, International Movies","During a vacation with her parents, away from her concrete urban existence, a young girl learns to appreciate the joys of connecting with nature.",127
Aitraaz,"Abbas Alibhai Burmawalla, Mastan Alibhai Burmawalla","Akshay Kumar, Kareena Kapoor, Priyanka Chopra, Amrish Puri, Paresh Rawal, Annu Kapoor",India,"2018-03-01 00:00:00",2004,TV-14,"International Movies, Music & Musicals, Romantic Movies","A happily married business executive is forced to deal with an episode from his past that he had long thought was put behind him.",153
Aiyaary,"Neeraj Pandey","Sidharth Malhotra, Manoj Bajpayee, Rakul Preet Singh, Pooja Chopra, Adil Hussain, Kumud Mishra, Naseeruddin Shah, Anupam Kher, Vikram Gokhale, Juhi Babbar",India,"2018-05-15 00:00:00",2018,TV-MA,"Action & Adventure, Dramas, International Movies","When his protégé goes rogue and poses a grave threat to the government he serves, a veteran officer of the Indian Army tries to stop him at all costs.",158
Aiyyaa,"Sachin Kundalkar","Rani Mukerji, Prithviraj Sukumaran, Nirmiti Sawant, Subodh Bhave, Jyoti Subhash, Satish Alekar, Anita Date, Amey Wagh, Kishori Balal, Pakoda Pandi",India,"2020-07-05 00:00:00",2012,TV-14,"Comedies, International Movies, Music & Musicals","An outspoken, imaginative girl from a conservative family pursues her dream man while fending off the prospect of an arranged marriage.",151
"Ajab Prem Ki Ghazab Kahani","Rajkumar Santoshi","Ranbir Kapoor, Katrina Kaif, Govind Namdeo, Darshan Jariwala, Zakir Hussain, Smita Jaykar, Navneet Nishan, Dolly Bindra, Upen Patel",India,"2020-10-25 00:00:00",2009,TV-14,"Comedies, International Movies, Music & Musicals","A young man's obsession with making others happy drives him to help the girl he loves marry someone else, then try to win her heart.",150
Ajji,"Devashish Makhija","Sushama Deshpande, Abhishek Banerjee, Smita Tambe, Sharvani Suryavanshi, Vikas Kumar, Sadiya Siddiqui, Sudhir Pandey, Manuj Sharma",India,"2018-05-01 00:00:00",2017,TV-MA,"Dramas, International Movies","When her small granddaughter is sexually assaulted by a powerful man and no justice is served, a poor, frail old woman plots her violent revenge.",105
"AK vs AK","Vikramaditya Motwane","Anil Kapoor, Anurag Kashyap",India,"2020-12-25 00:00:00",2020,TV-MA,"Comedies, Dramas, International Movies","After a public spat with a movie star, a disgraced director retaliates by kidnapping the actor’s daughter, filming the search for her in real time.",109
"Al acecho","Francisco D'Eufemia","Rodrigo de la Serna, Belen Blanco, Walter Jakob, Facundo Aquinos, Patricia Calisaya",NULL,"2021-01-12 00:00:00",2019,TV-MA,"International Movies, Thrillers","Looking for a fresh start, a park ranger gets a new assignment. When he discovers a network of poachers, survival depends on his lethal instincts.",81
"Ala Vaikunthapurramuloo","Trivikram Srinivas","Allu Arjun, Pooja Hegde, Tabu, Sushanth, Nivetha Pethuraj, Jayaram, Murli Sharma",India,"2020-02-27 00:00:00",2020,TV-14,"Action & Adventure, Comedies, Dramas","After growing up enduring criticism from his father, a young man finds his world shaken upon learning he was switched at birth with a millionaire’s son.",162
"Alakada Reloaded","Toyin Abraham","Kehinde Bankole, Lilian Esoro, Bolaji Amusan, Toyin Abraham, Gabriel Afolayan, Bidemi Kosoko, Wumi Toriola, Tayo Amokade, Helen Paul, Liz DaSilva",NULL,"2020-03-06 00:00:00",2017,TV-MA,"Comedies, International Movies","To cope with her feelings of inferiority, a woman from an impoverished family tells tall tales of her wealth and influence to upgrade her social status.",104
"Alan Saldaña: Mi vida de pobre","Raúl Campos, Jan Suter","Alan Saldaña",Mexico,"2017-08-04 00:00:00",2017,TV-MA,"Stand-Up Comedy","Mexican comic Alan Saldaña has fun with everything from the pressure of sitting in an exit row to maxing out his credit card in this stand-up special.",54
"Alarmoty in the Land of Fire",NULL,NULL,Egypt,"2019-08-05 00:00:00",2017,TV-MA,"Comedies, International Movies","While vacationing at a resort, an ornery and outspoken man is held captive by a criminal organization.",94
"Alaska Is a Drag","Shaz Bennett","Martin L. Washington Jr., Maya Washington, Matt Dallas, Christopher O'Shea, Jason Scott Lee, Margaret Cho, Kevin Daniels, John Fleck, Nia Peeples, Adam Tomei","United States","2020-12-31 00:00:00",2017,TV-MA,"Dramas, LGBTQ Movies","Tormented by bullies, an aspiring drag star working at an Alaskan cannery becomes a skilled fighter and is tapped for competition by a boxing coach.",83
"Albert Pinto Ko Gussa Kyun Aata Hai?","Soumitra Ranade","Nandita Das, Manav Kaul, Saurabh Shukla, Kishore Kadam, Omkar Das Manikpuri, Amarjeet Amle, Yusuf Hussain, Sushma Bakshi",India,"2019-12-31 00:00:00",2019,TV-MA,"Dramas, Independent Movies, International Movies","As the police investigate his disappearance, a young man heads to Goa to carry out an act of vengeance fueled by years of pent-up anger toward society.",85
"Albion: The Enchanted Stallion","Castille Landon","Daniel Sharman, Jennifer Morrison, Debra Messing, Stephen Dorff, John Cleese, Liam McIntyre, Richard Kind, Avery Arendes, Castille Landon","United States, Bulgaria","2017-07-01 00:00:00",2016,TV-PG,"Children & Family Movies","After a magical horse transports her to a fantasy world ruled by an evil general, a brave girl sets out to save the land once and for all.",106
"Alejandro Riaño: Especial de stand up",NULL,"Alejandro Riaño",Colombia,"2018-01-10 00:00:00",2018,TV-MA,"Stand-Up Comedy","Colombian comedian Alejandro Riaño discusses the perks of dating a she-wolf, styles of dancing, the quirks of Bogotá men and soccer game announcers.",60
"Alejandro Sanz: What I Was Is What I Am","Gervasio Iglesias, Alexis Morante","Alejandro Sanz",Spain,"2018-08-18 00:00:00",2018,TV-MA,"Documentaries, International Movies, Music & Musicals","A retrospective look at the life and career of Grammy-award winning Spanish musician Alejandro Sanz.",102
Alelí,"Leticia Jorge Romero","Néstor Guzzini, Mirella Pascual, Cristina Morán, Romina Peluffo, Laila Reyes Silberberg, Pablo Tate, Gerónimo Pizzanelli, Georgina Yankelevich, Julio Icasuriaga, Carla Moscatelli","Uruguay, Argentina","2020-04-16 00:00:00",2019,TV-MA,"Comedies, Dramas, International Movies","Mourning their father's death, a dysfunctional trio of siblings must face selling their beloved childhood beach house — and dealing with each other.",88
"Alex Fernández: The Best Comedian in the World","Alex Díaz","Alex Fernández",Mexico,"2020-01-23 00:00:00",2020,TV-MA,"Stand-Up Comedy","Comic Alex Fernández performs his familiar autobiographical stories but goes a little deeper this time with a tender tale about one of his six siblings.",51
"Alex Strangelove","Craig Johnson","Daniel Doheny, Madeline Weinstein, Antonio Marziale, Daniel Zolghadri, Annie Q., Nik Dodani, Fred Hechinger, Kathryn Erbe, Isabella Amara, Sophie Faulkenberry","United States","2018-06-08 00:00:00",2018,TV-MA,"Comedies, Dramas, Independent Movies","High school senior Alex Truelove's plan to lose his virginity to lovable girlfriend Claire goes awry when he meets the equally lovable Elliot.",100
"Alexandria ... Why?","Youssef Chahine","Naglaa Fathi, Farid Shawqy, Mohsen Mohiedine, Ezzat El Alaili, Abdalla Mahmoud, Youssef Wahby, Yehia Chahine, Laila Fawzy, Mahmoud El Meleigy, Ahmed Zaki, Gerry Sundquist","Egypt, Algeria","2020-06-18 00:00:00",1979,TV-MA,"Classic Movies, Dramas, International Movies","Living in Alexandria during World War II, an Egyptian teen enamored with American films dreams of making it in Hollywood.",131
"Alexandria: Again and Forever","Youssef Chahine","Youssef Chahine, Yousra, Hussein Fahmy, Amr Abdel-Geleel, Taheya Cariocca, Hesham Selim, Huda Sultan, Ragaa Hussein","France, Egypt","2020-06-18 00:00:00",1989,TV-MA,"Classic Movies, Dramas, International Movies","At the peak of his career, Yehia joins a hunger strike, becomes smitten and reckons with a creative crisis — but finds a new muse.",109
"Alexis Viera: A Story of Surviving","Luis Ara","Alexis Viera",Uruguay,"2019-03-20 00:00:00",2019,TV-MA,"Documentaries, International Movies, Sports Movies","After being shot during a robbery in Colombia and losing sensation in his legs, Uruguayan soccer star Alexis Viera finds a new sense of purpose.",69
"Ali & Alia","Hussein El Ansary","Khalifa Albhri, Neven Madi, Talal Mahmood, Sawsan Saad, Fatma Hassan","United Arab Emirates","2020-05-12 00:00:00",2019,TV-14,"Dramas, International Movies, Romantic Movies","Drugs and addiction endanger the love — and lives — of two childhood sweethearts struggling to survive the perils of a precarious world.",106
"Ali Baba ve 7 Cüceler","Cem Yılmaz","Cem Yılmaz, Irina Ivkina, Çetin Altay, Zafer Algöz, Can Yılmaz, Bahtiyar Engin, Fevzi Gökçe, Yosi Mizrahi",Turkey,"2020-07-01 00:00:00",2015,TV-MA,"Action & Adventure, Comedies, International Movies","A garden gnome vendor and his brother-in-law attend a trade fair in Sofia, where they accidentally stumble into shenanigans involving a mafia boss.",115
"Ali Wong: Baby Cobra","Jay Karas","Ali Wong","United States","2016-05-06 00:00:00",2016,TV-MA,"Stand-Up Comedy","Ali Wong's stand up special delves into her sexual adventures, hoarding, the rocky road to pregnancy, and why feminism is terrible.",60
"Ali Wong: Hard Knock Wife","Jay Karas","Ali Wong","United States","2018-05-13 00:00:00",2018,TV-MA,"Stand-Up Comedy","Two years after the hit "Baby Cobra," Ali Wong is back with another baby bump – and a torrent of hilarious truths about marriage and motherhood.",64
"Ali's Wedding","Jeffrey Walker","Osamah Sami, Don Hany, Helana Sawires, Frances Duca, Majid Shokor, Rodney Afif, Ghazi Alkinani, Ryan Corr",Australia,"2018-06-08 00:00:00",2018,TV-MA,"Comedies, Independent Movies, International Movies","After telling a white lie that spins out of control, the son of an Iraqi-born cleric in Melbourne becomes torn between family duty and his own heart.",110
"Alias JJ, la celebridad del mal",NULL,NULL,NULL,"2017-09-01 00:00:00",2017,TV-MA,"Documentaries, International Movies","Witnesses and public figures respond to controversial claims about Pablo Escobar made by the Medellín Cartel's sole survivor, John Jairo Velásquez.",54
"Alibaba Aur 40 Chor","Latif Faiziyev, Umesh Mehra","Dharmendra, Hema Malini, Zeenat Aman, Rolan Bykov, Prem Chopra, Yakub Akhmedov, Madan Puri, Sofiko Chiaureli","Soviet Union, India","2018-01-15 00:00:00",1980,TV-14,"Action & Adventure, International Movies, Sci-Fi & Fantasy","A simple village man is thrown into a web of political intrigue after he takes on a powerful and ruthless gang of bandits.",147
"Alice Doesn't Live Here Anymore","Martin Scorsese","Ellen Burstyn, Kris Kristofferson, Billy Green Bush, Diane Ladd, Harvey Keitel, Lelia Goldoni, Lane Bradbury, Vic Tayback, Jodie Foster, Alfred Lutter","United States","2019-07-01 00:00:00",1974,PG,"Classic Movies, Comedies, Dramas","A widowed singer and single mother starts over as a diner waitress in Arizona, befriending her coworkers and romancing a ruggedly handsome rancher.",112
"Alice Junior","Gil Baroni","Anne Celestino Mota, Emmanuel Rosset, Matheus Moura, Surya Amitrano, Thaís Schier, Cida Rolim, Katia Horn, Igor Augustho, Marcel Szymanski",Brazil,"2020-10-23 00:00:00",2019,TV-MA,"Comedies, International Movies, LGBTQ Movies","In a small town, a trans teen with a vibrant personality shakes up her high school's conservative ways while trying to secure her first kiss.",87
"Alien Contact: Outer Space","J. Michael Long","J. Michael Long","United States","2018-01-09 00:00:00",2017,TV-PG,Documentaries,"This fact-based account delves into humankind's efforts to gather signals from possible intelligent beings beyond the solar system.",63
"Alien Warfare","Jeremiah Jones","Clayton Snyder, David Meadows, Daniel Washington, Scott C. Roe, Larissa Andrade, Sal Rendino, Jose Guns Alves, Scott King","United States","2019-04-05 00:00:00",2019,TV-MA,"Action & Adventure, Sci-Fi & Fantasy","The U.S. Navy Seal team tackles a top-secret mission at a research center where scientists have mysteriously disappeared and another life form awaits.",88
"Alien Xmas","Stephen Chiodo","Keythe Farley, Dee Bradley Baker, Kaliayh Rhambo, Michelle Deco, Barbara Goodson","United States","2020-11-20 00:00:00",2020,TV-Y,"Children & Family Movies","A young elf mistakes a tiny alien for a Christmas gift, not knowing her new plaything has plans to destroy Earth's gravity — and steal all the presents.",42
"Aliens Ate My Homework","Sean McNamara","William Shatner, Dan Payne, Kirsten Robek, Ty Consiglio, Sean McNamara, Christian Convery, Jayden Greig, Lauren McNamara, Alex Zahara, Sandy Robson","United States","2018-03-06 00:00:00",2018,PG,"Children & Family Movies, Comedies, Sci-Fi & Fantasy","Tiny alien lawmen fly into Rod's bedroom and recruit him into helping them stop an intergalactic criminal – who's disguised as a very familiar human.",90
"Alive and Kicking","Susan Glatzer",NULL,"Sweden, United States","2017-08-10 00:00:00",2016,TV-14,Documentaries,"Take an inside look at swing dancing's continued prosperity and the lively and joyous personalities that make the art form so unique.",89
"All About Love","Adze Ugah","Chris Attoh, Katlego Danke, Enyinna Nwigwe, Nomzamo Mbatha, Richard Lukunku, Zenande Mfenyane, Leroy Gopal, Angela Sithole","South Africa","2020-03-06 00:00:00",2017,TV-MA,"Dramas, International Movies, Romantic Movies","An inseparable couple struggles to stay together when betrayal threatens to tear their lives apart.",79
"All About Nina","Eva Vives","Mary Elizabeth Winstead, Common, Kate del Castillo, Chace Crawford, Jay Mohr, Beau Bridges, Clea DuVall, Melonie Diaz, Camryn Manheim, Mindy Sterling, Angelique Cabral, Nicole Byer, Todd Louiso, Elizabeth Masucci, Sonoya Mizuno, Charlotte Newhouse, Victor Rasuk, Andree Vermeulen","United States","2019-03-18 00:00:00",2018,R,"Comedies, Dramas, Independent Movies","Fearless provocation has fueled stand-up comic Nina Geld's career, but a move to LA and a new love take her to new levels of honesty.",101
"All Because of You","Adrian Teh","Hairul Azreen, Janna Nick, Amerul Affendi, Henley Hii, Nam Ron, Theebaan Govindasamy, Taufiq Hanafi, Hafizul Kamal, Josiah Hogan, Sophia Albarakbah, Sugeeta Chandran, Anna Jobling",Malaysia,"2020-10-01 00:00:00",2020,TV-PG,"Action & Adventure, Comedies, International Movies","After falling for a guest, an unsuspecting hotel staff becomes embroiled in a hostage scheme and discovers true love in an unlikely place.",102
"All Day and a Night","Joe Robert Cole","Jeffrey Wright, Ashton Sanders, Regina Taylor, Yahya Abdul-Mateen II, Isaiah John, Kelly Jenrette, Shakira Ja-nai Paye","United States","2020-05-01 00:00:00",2020,R,"Dramas, Independent Movies","While serving life in prison, a young man looks back at the people, the circumstances and the system that set him on the path toward his crime.",122
"All Dogs Go to Heaven","Don Bluth, Gary Goldman, Dan Kuenster","Dom DeLuise, Burt Reynolds, Daryl Gilley, Candy Devine, Charles Nelson Reilly, Vic Tayback, Melba Moore, Judith Barsi, Rob Fuller, Earleen Carey, Anna Manahan, Nigel Pegram, Loni Anderson, Ken Page, Godfrey Quigley","Ireland, United Kingdom, United States","2020-06-01 00:00:00",1989,G,"Children & Family Movies","When a canine con artist becomes an angel, he sneaks back to Earth and crosses paths with an orphan girl who can speak to animals.",85
"All Good Ones Get Away","Víctor García","Claire Forlani, Jake Abel, Titus Welliver, Melina Matthews","Spain, Italy","2019-07-30 00:00:00",2019,TV-MA,"International Movies, Thrillers","When a mysterious figure blackmails an adulterous couple during a romantic getaway, their secret affair turns into a fight for survival.",83
"All Hallows' Eve","Charlie Vaughn","Lexi Giovagnoli, Ashley Argota, John DeLuca, Diane Salinger, Martin Klebba, Tracey Gold, Dee Wallace, Pilot Paisley-Rose, Daniel Cooksley, Vincent Giovagnoli, Dillon Cavitt","United States","2017-08-01 00:00:00",2016,TV-G,"Children & Family Movies, Independent Movies","Instead of summoning the spirit of her dearly departed mother, a charming teen accidentally awakens a vengeful witch who wants to destroy her town.",92
"All In My Family","Hao Wu",NULL,"United States","2019-05-03 00:00:00",2019,TV-14,"Documentaries, LGBTQ Movies","After starting a family of his very own in America, a gay filmmaker documents his loving, traditional Chinese family's process of acceptance.",40
"All Light Will End","Chris Blake","Ashley Pereira, Alexandra Harris, Ted Welch, Sam Jones III, Sarah Butler, Andy Buckley, Graham Outerbridge, Michael James Thomas, John Schuck, Aaron Munoz","United States","2019-02-02 00:00:00",2018,TV-MA,"Horror Movies, Thrillers","A horror novelist with a traumatic past returns to her childhood hometown, where she revisits her night terrors and loses sight of reality.",84
"All of You","Dan Villegas","Jennylyn Mercado, Derek Ramsay, Yayo Aguila, Kean Cipriano, Nico Antonio, Enzo Marcos, Via Antonio, Hannah Ladesma",Philippines,"2019-01-11 00:00:00",2017,TV-MA,"Comedies, Dramas, International Movies","Two strangers meet on a dating app and experience instant chemistry, but their relationship unravels as jarring differences catch up to them.",104
"All the Boys Love Mandy Lane","Jonathan Levine","Anson Mount, Edwin Hodge, Michael Welch, Brooke Bloom, Amber Heard, Aaron Himelstein, Whitney Able, Luke Grimes, Melissa Price","United States","2018-07-03 00:00:00",2006,R,"Horror Movies","During a weekend excursion to a secluded ranch, an unwelcome visitor begins picking off the randy admirers of teenage temptress Mandy Lane.",91
"All The Bright Places","Brett Haley","Elle Fanning, Justice Smith, Luke Wilson, Keegan-Michael Key, Alexandra Shipp, Lamar Johnson, Virginia Gardner, Kelli O'Hara, Felix Mallard, Sofia Hasmik","United States","2020-02-28 00:00:00",2020,TV-MA,"Dramas, Romantic Movies","Two teens facing personal struggles form a powerful bond as they embark on a cathartic journey chronicling the wonders of Indiana.",109
"All the Devil's Men","Matthew Hope","Milo Gibson, Sylvia Hoeks, Gbenga Akinnagbe, William Fichtner, Joseph Millson, Elliot Cowan, Perry Fitzpatrick, Warren Rusher","United Kingdom","2019-05-15 00:00:00",2018,R,"Action & Adventure","A battle-scarred Special Ops military vet joins a CIA-funded assignment to take down a Russian terrorist and his trigger-happy comrades.",100
"All the Freckles in the World","Yibrán Asuad","Hánssel Casillas, Loreto Peralta, Andrea Sutton, Luis De La Rosa, Alejandro Flores, Anajosé Aldrete, Daniel Haddad, Montserrat Marañón, Juan Carlos Viana Prieto, Hernán Del Riego",Mexico,"2020-01-03 00:00:00",2020,TV-14,"Comedies, International Movies, Romantic Movies","Thirteen-year-old José Miguel is immune to 1994 World Cup fever until he realizes soccer is the only way to win the heart of his crush.",90
"All The Reasons To Forget","Pedro Coutinho","Johnny Massaro, Bianca Comparato, Regina Braga, Maria Laura Nogueira, Victor Mendes, Thiago Amaral, Rafael Primot, Eduardo Mossri, Rita Batata, Larissa Ferrara",Brazil,"2018-04-19 00:00:00",2017,TV-MA,"Comedies, Dramas, International Movies","A Brazilian man tries a myriad of ways to get over his breakup with his girlfriend but is surprised to learn it's more difficult than he anticipated.",90
"All Together Now","Brett Haley","Auli'i Cravalho, Justina Machado, Rhenzy Feliz, Fred Armisen, Carol Burnett, Judy Reyes, Taylor Richardson, C.S. Lee, Anthony Jacques","United States","2020-08-29 00:00:00",2020,PG,Dramas,"An optimistic, talented teen clings to a huge secret: She's homeless and living on a bus. When tragedy strikes, can she learn to accept a helping hand?",94
"All's Well, End's Well (2009)","Vincent Kok","Louis Koo, Sandra Ng Kwan Yue, Raymond Wong, Ronald Cheng, Yao Chen, Guo Tao, Heung Kam Lee, Chun Chau Ha, Miki Shum","Hong Kong","2018-11-09 00:00:00",2009,TV-14,"Comedies, International Movies, Romantic Movies","Bound by a family rule that forbids him from marrying until his stubborn sister gets hitched, a bachelor enlists the help of a love guru to woo her.",99
"Alles ist gut","Eva Trobisch","Aenne Schwarz, Andreas Döhler, Hans Löw, Tilo Nest, Lina Wendel, Lisa Hagmeister",Germany,"2019-06-06 00:00:00",2019,TV-MA,"Dramas, International Movies","A woman sexually assaulted by her new boss's brother-in-law tries to move on as if nothing happened, but the night weighs heavily on her mind and body.",90
"AllI Wish","Susan Walter","Sharon Stone, Tony Goldwyn, Liza Lapira, Ellen Burstyn, Jason Gibson, Famke Janssen, Caitlin Fitzgerald, Gilles Marini, Erica Ash, Tom Paolino","United States","2020-03-18 00:00:00",2017,R,"Dramas, Romantic Movies","Over a series of birthdays, a happy-go-lucky, commitment-averse fashion designer strives to bring a bit of calm to her chaotic love life.",95
"Almost Love","Mike Doyle","Scott Evans, Augustus Prew, Kate Walsh, Michelle Buteau, Zoë Chao, Patricia Clarkson, Colin Donnell, Christopher Gray","United States","2020-08-02 00:00:00",2020,TV-MA,"Comedies, Dramas, Independent Movies","A close crew of striving New Yorkers experiences both joy and heartache in their romantic and professional lives.",92
"Alone in Berlin","Vincent Perez","Emma Thompson, Brendan Gleeson, Daniel Brühl, Monique Chaumette, Joachim Bissmeier, Katrin Pollitt, Lars Rudolph, Uwe Preuss, Daniel Sträßer, Rainer Reiners, Mikael Persbrandt","United Kingdom, France, Germany","2019-02-15 00:00:00",2016,R,Dramas,"After learning of their son's death on the battlefield, a grieving Berlin couple embark on a quietly dangerous act of resistance against Adolf Hitler.",103
