title,director,cast,country,date_added,release_year,rating,listed_in,description,duration_in_minutes
Bhouri,"Jasbir Bijendra Bhati","Raghuvir Yadav, Masha Paur, Mohan Joshi, Manoj Joshi, Mukesh Tiwari, Shakti Kapoor, Sitaram Panchal, Kunika Lall",India,"2017-12-01 00:00:00",2017,TV-14,"Dramas, Independent Movies, International Movies","A 23-year-old girl who's married to a man more than twice her age is forced to contend with the predatory nature of a male-dominated society.",123
"Bibi & Tina","Detlev Buck","Lina Larissa Strahl, Lisa-Marie Koroll, Louis Held, Ruby O. Fee, Charly Hübner, Michael Maertens, Winnie Böwe, Fabian Buch, Max von der Groeben, Martin Seifert",Germany,"2017-04-15 00:00:00",2014,TV-PG,"Children & Family Movies, Music & Musicals","Teen witch Bibi and horse-loving Tina face trouble when a posh girl flirts with Tina's boyfriend and a crook sets his greedy eyes on a promising foal.",97
"Bibi & Tina II","Detlev Buck","Lina Larissa Strahl, Lisa-Marie Koroll, Louis Held, Emilio Moutaoukkil, Michael Maertens, Martin Seifert, Winnie Böwe, Fabian Buch, Mavie Hörbiger, Olli Schulz, Charly Hübner, Milan Peschel",Germany,"2017-04-15 00:00:00",2014,TV-14,"Children & Family Movies, Music & Musicals","When robbers hit Falkenstein castle, teen witch Bibi and pal Tina hunt for the crooks, then devise a plan to save the neighbors' failing ranch.",105
"Bibi & Tina: Girls Versus Boys","Detlev Buck","Lina Larissa Strahl, Lisa-Marie Koroll, Tilman Pörzgen, Philipp Laude, Charly Hübner, Louis Held, Benjamin Lutzke, Max von der Groeben, Kostja Ullmann, Michael Maertens, Fabian Buch, Winnie Böwe",Germany,"2017-04-15 00:00:00",2016,TV-14,"Children & Family Movies, Music & Musicals","At summer camp, young Bibi and her friends are pitted against the boys in a treasure hunt. But what's a witch to do when she loses her powers?",107
"Bibi & Tina: Tohuwabohu Total","Detlev Buck","Lina Larissa Strahl, Lisa-Marie Koroll, Louis Held, Lea van Acken, Emilio Sakraya, Michael Maertens, Martin Seifert",Germany,"2017-12-27 00:00:00",2017,TV-14,"Children & Family Movies, Music & Musicals","Teen witch Bibi and her pal Tina return to the screen to reconcile a runaway girl with her narrow-minded family and save Falkenstein Castle from chaos.",106
"Big Bear","Joey Kern","Joey Kern, Adam Brody, Zachary Knighton, Tyler Labine, Pablo Schreiber, Toby Huss, Heidi Heaslet, Ahna O'Reilly","United States","2018-02-28 00:00:00",2017,TV-MA,Comedies,"The alcohol-fueled high jinks of a bachelor party go haywire when the buddies of an ill-fated groom abduct his fiancée's new lover.",87
"Big Daddy","Dennis Dugan","Adam Sandler, Joey Lauren Adams, Jon Stewart, Cole Sprouse, Dylan Sprouse, Josh Mostel, Leslie Mann, Allen Covert, Rob Schneider, Kristy Swanson","United States","2020-10-01 00:00:00",1999,PG-13,Comedies,"Dumped by his girlfriend because he refuses to accept responsibility, overgrown adolescent Sonny Koufax adopts a 5-year-old to prove he's a grownup.",93
"Big Fat Liar","Shawn Levy","Frankie Muniz, Paul Giamatti, Amanda Bynes, Amanda Detmer, Donald Faison, Sandra Oh, Russell Hornsby, Michael Bryan French, Christine Tucci, Lee Majors, John Cho","United States, Germany","2020-01-15 00:00:00",2002,PG,"Children & Family Movies, Comedies","Junior high students Jason and Kaylee take action when a greedy Hollywood producer turns Jason's essay into a hit film without giving him credit.",88
"Big Kill","Scott Martin","Christoph Sanders, Jason Patric, Clint Glenn Hummel, Lou Diamond Phillips, Danny Trejo, Scott Martin, Elizabeth McLaughlin, Stephanie Beran, K.C. Clyde, Michael Paré","United States","2019-06-18 00:00:00",2018,R,"Action & Adventure","A tenderfoot and two gamblers seeking their fortunes in a boom town instead find themselves defending it from a gunslinging preacher and his gang.",126
"Big Miracle","Ken Kwapis","Drew Barrymore, John Krasinski, Kristen Bell, Dermot Mulroney, Tim Blake Nelson, Vinessa Shaw, Ted Danson, Stephen Root, Rob Riggle, Michael Gaston","United States, United Kingdom","2018-09-30 00:00:00",2012,PG,"Children & Family Movies, Dramas","After a reporter writes about whales trapped in the Arctic Circle, the U.S. and U.S.S.R. team up to rescue them in this tale inspired by true events.",107
"Big Stone Gap","Adriana Trigiani","Ashley Judd, Patrick Wilson, Whoopi Goldberg, John Benjamin Hickey, Jane Krakowski, Judith Ivey, Jasmine Guy, Chris Sarandon, Anthony LaPaglia, Jenna Elfman, Angelina Fiordellisi, Mary Testa, Dagmara Dominczyk, Mary Pat Gleason, Joe Inscoe, James Hampton, Paul Wilson","United States","2020-06-05 00:00:00",2014,PG-13,"Comedies, Romantic Movies","A single middle-aged woman who has lived her whole life in a small Virginia mining town uncovers a family secret that alters her profoundly.",103
"Big Time","Kaspar Astrup Schröder","Bjarke Ingels",Denmark,"2018-04-01 00:00:00",2017,TV-MA,Documentaries,"In this documentary, architect Bjarke Ingels offers his vision for 2 World Trade Center as he aims to restore Manhattan's skyline to its former glory.",90
"Big Time Movie","Savage Steve Holland","Kendall Schmidt, James Maslow, Carlos PenaVega, Logan Henderson, Ciara Bravo, Challen Cates, Tanya Chisholm, Stephen Kramer Glickman, Trevor Devall, Christopher Shyer","United States, Canada","2019-11-02 00:00:00",2012,TV-PG,"Children & Family Movies, Comedies, Music & Musicals","Big Time Rush heads to London for their first world tour, but when the boys' bags are switched, they get mixed up in a mission to save the world.",68
"Bigflo & Oli: Hip Hop Frenzy","Bigflo & Oli, Jérémie Levypon","Bigflo & Oli",France,"2020-10-08 00:00:00",2020,TV-MA,"Documentaries, International Movies, Music & Musicals","Go backstage with French rap duo Bigflo & Oli in this intimate music documentary, then join the superstar siblings as they embark on a major tour.",100
"Bigger Fatter Liar","Ron Oliver","Ricky Garcia, Jodelle Ferland, Barry Bostwick, Fiona Vroom, Kevin O'Grady, Karen Holness","United States","2017-04-18 00:00:00",2017,PG,"Children & Family Movies, Comedies","When his video game concept is stolen by a dishonest executive, a teenage chronic liar sets out to prove that he's telling the truth, for once.",95
"Biggie & Tupac","Nick Broomfield","Nick Broomfield","United Kingdom","2019-01-26 00:00:00",2002,R,"Documentaries, Music & Musicals","British documentarian Nick Broomfield investigates the murders of rappers Tupac Shakur and Biggie Smalls, digging up some surprises in the process.",108
"Bikram: Yogi, Guru, Predator","Eva Orner","Bikram Choudhury","United States","2019-11-20 00:00:00",2019,TV-MA,Documentaries,"This documentary charts the rise and fall of hot yoga founder Bikram Choudhury as his global empire is born and disturbing revelations come to light.",86
"Bill Burr: I'm Sorry You Feel That Way","Jay Karas","Bill Burr","United States","2014-12-05 00:00:00",2014,TV-MA,"Stand-Up Comedy","Bill Burr escapes the zombie apocalypse, explores how rom-coms ruin great sex and explains how too many childhood hugs may be the downfall of man.",81
"Bill Burr: Let It Go","Shannon Hartman","Bill Burr","United States","2017-11-10 00:00:00",2010,NR,"Stand-Up Comedy","The musings of comedian Bill Burr are let loose in this special, which was filmed at the historic Fillmore Auditorium in San Francisco.",65
"Bill Burr: Paper Tiger","Mike Binder","Bill Burr","United States, United Kingdom","2019-09-10 00:00:00",2019,TV-MA,"Stand-Up Comedy","Bill Burr unloads on outrage culture, male feminism, cultural appropriation, robot sex and more in a blistering stand-up special shot in London.",67
"Bill Burr: Walk Your Way Out","Jay Karas","Bill Burr","United States","2017-01-31 00:00:00",2017,TV-MA,"Stand-Up Comedy","No-nonsense comic Bill Burr takes the stage in Nashville and riffs on fast food, overpopulation, dictators and gorilla sign language.",78
"Bill Burr: You People Are All the Same","Jay Karas","Bill Burr","United States","2018-06-30 00:00:00",2012,TV-MA,"Stand-Up Comedy","Funnyman Bill Burr takes the stage to uncork a profanity-laced, incisive routine that pokes fun at plastic surgery, reality TV, gold diggers and more.",69
"Bill Hicks: One Night Stand","John Fortenberry","Bill Hicks","United Kingdom","2018-12-31 00:00:00",1991,TV-MA,"Stand-Up Comedy","Bill Hicks remembers a wild night in 1989 and offers his views on puffing cigarettes, smoking weed, drinking, sex, commercials and music.",28
"Bill Hicks: Reflections",NULL,"Bill Hicks, Steve Hicks",NULL,"2018-12-31 00:00:00",2015,TV-MA,Documentaries,"This documentary about comedian Bill Hicks offers insight into his irreverent takes on, well, everything. Brother Steve Hicks is the star witness.",34
"Bill Hicks: Relentless","Chris Bould","Bill Hicks","United Kingdom","2018-12-31 00:00:00",1992,TV-MA,"Stand-Up Comedy","In one of his most iconic performances, late comedian Bill Hicks demonstrates what made him such a singular talent and a force to be reckoned with.",61
"Bill Hicks: Revelations","Chris Bould","Bill Hicks","United Kingdom","2018-12-31 00:00:00",1993,TV-MA,"Stand-Up Comedy","In his final recorded special, the iconoclastic comedian channels Goat Boy and tackles provocative topics like British porn, pot and the priesthood.",56
"Bill Hicks: Sane Man","Kevin Booth, David Johndrow","Bill Hicks","United States","2018-12-31 00:00:00",1989,TV-MA,"Stand-Up Comedy","Filmed in 1989 at a turning point in comedian Bill Hicks's career, this rare onstage performance captures him spouting off on a variety of topics.",81
"Bill Nye: Science Guy","Jason Sussberg, David Alvarado","Bill Nye, Neil deGrasse Tyson, Eugenie Scott, Francis Collins, Ann Druyan","United States","2018-04-25 00:00:00",2017,TV-PG,Documentaries,"The dynamic, bow-tied host behind the young adult science show faces climate-change skeptics as he demonstrates the importance of scientific evidence.",97
Billu,Priyadarshan,"Irrfan Khan, Shah Rukh Khan, Lara Dutta, Rajpal Yadav, Om Puri, Asrani, Manoj Joshi",India,"2018-04-01 00:00:00",2009,TV-PG,"Dramas, International Movies","An Indian village is abuzz with news that a major movie star is coming to town – even more so because the town barber went to school with him. But as the day of the actor's visit approaches, the humble barber begins to worry he won't be recognized.",132
"Billy Elliot","Stephen Daldry","Jamie Bell, Gary Lewis, Stuart Wells, Billy Fane, Colin MacLachlan, Nicola Blackwell, Carol McGuigan, Joe Renton, Janine Birkett, Charlie Hardwick, Mike Elliot, Jean Heywood, Jamie Draven, Julie Walters, Trevor Fox, Adam Cooper","United Kingdom, France","2019-02-01 00:00:00",2000,R,"Dramas, Independent Movies, International Movies","When a boy trades boxing school for ballet lessons, he may take his newfound talent all the way to the top - and win over his disapproving father.",110
"Billy Graham: An Extraordinary Journey","Vonda Harrell, Daniel Camenisch","Billy Graham, Jeff Hoyt, Tom Brokaw, Greta Van Susteren, Diane Sawyer, Larry King, George Bush Sr., George W. Bush, Bill Clinton, Franklin Graham","United States","2019-02-28 00:00:00",2018,TV-PG,"Documentaries, Faith & Spirituality","This documentary recounts the life story of evangelist preacher Billy Graham featuring interviews with family members and former presidents.",66
"Bilu Rakkhosh","Indrasis Acharya","Joy Sengupta, Koneenica Banerjee, Kanchana Moitra, Pradip Mukherjee",India,"2018-03-15 00:00:00",2017,TV-MA,"Dramas, International Movies","Torn between his demanding corporate career, his passion for music and his turbulent family life, a man struggles to keep his inner demons in check.",127
Bioscope,"Gajendra Ahire, Viju Mane, Girish Mohite, Ravi Jadhav","Nina Kulkarni, Suhas Palshikar, Kushal Badrike, Spruha Joshi, Mangesh Desai, Smita Tambe, Veena Jamkar, Sandeep Khare",India,"2018-08-15 00:00:00",2015,TV-14,"Dramas, International Movies, LGBTQ Movies","Inspired by classic and contemporary literature, four renowned Marathi directors create four individual stories in this anthology of short films.",131
"Bir Baba Hindu","Sermiyan Midyat","Sermiyan Midyat, Şafak Sezer, Nicole Faria, Burak Satıbol","Turkey, India","2020-04-28 00:00:00",2016,TV-MA,"Action & Adventure, Comedies, International Movies","A Istanbul mobster falls for an Indian yoga instructor whose abduction takes him on a wild rescue mission to Mumbai.",107
"Bird Box","Susanne Bier","Sandra Bullock, Trevante Rhodes, John Malkovich, Sarah Paulson, BD Wong, Jacki Weaver, Rosa Salazar, Danielle Macdonald, Lil Rel Howery, Tom Hollander","United States","2018-12-21 00:00:00",2018,R,"Dramas, Sci-Fi & Fantasy, Thrillers","Five years after an ominous unseen presence drives most of society to suicide, a survivor and her two children make a desperate bid to reach safety.",124
Birders,"Otilia Portillo Padua",NULL,"United States, Mexico","2019-09-25 00:00:00",2019,TV-G,"Documentaries, International Movies","Bird watchers on both sides of the U.S.-Mexico border share their enthusiasm for protecting and preserving some of the world's most beautiful species.",38
Birdshot,"Mikhail Red","Mary Joy Apostol, Arnold Reyes, Ku Aquino, John Arcilla, Dido Dela Paz, Elora Espano, Ronnie Quizon, Rolando T. Inocencio, Suzette Ranillo, Angelica C. Ferro","Philippines, Qatar","2018-03-26 00:00:00",2016,TV-MA,"Dramas, International Movies, Thrillers","A sheltered farm girl inadvertently shoots an endangered Philippine eagle, setting off a police investigation that exposes violence and corruption.",115
Birthmarked,"Emanuel Hoss-Desmarais","Toni Collette, Matthew Goode, Andreas Apergis, Michael Smiley, Fionnula Flanagan, Suzanne Clément, Jordan Poole, Megan O'Kelly, Anton Gillis-Adelman, Tyrone Benskin, Vincent Hoss-Desmarais",Canada,"2018-06-28 00:00:00",2018,TV-MA,"Comedies, Independent Movies, International Movies","In an attempt to settle the "nature vs. nurture" debate, a scientist couple raises three children to live lives that defy their genetic dispositions.",88
Bitch,"Marianna Palka","Jason Ritter, Jaime King, Marianna Palka, Brighton Sharbino, Rio Mangini, Jason Maybaum, Kingston Foster, Arielle Kebbel, Martin Starr, Roger Guenveur Smith, Caroline Aaron, Bill Smitrovich","United States","2018-03-11 00:00:00",2017,R,"Comedies, Dramas, Independent Movies","Cracking under the demands of children and a philandering, thankless husband, an overworked suburban mother assumes the persona of a ferocious dog.",97
"Bitcoin Heist","Ham Tran","Kate Nhung, Thanh Pham, Petey Majik Nguyen, Suboi, Jayvee Mai The Hiep, Lam Thanh My",Vietnam,"2017-09-02 00:00:00",2016,TV-14,"Action & Adventure, Comedies, International Movies","A unconventional, efficient Interpol special agent goes rogue and assembles a team of thieves to catch a shadowy hacker called "The Ghost."",116
Bittersweet,"Khaled Marei","Ahmed Helmy, Lotfy Labib, Edward, Enaam Salousa",Egypt,"2020-04-25 00:00:00",2010,TV-MA,"Comedies, Dramas, International Movies","After 20 years abroad, a photographer returns to his birth country of Egypt and gets stranded without identification in a now unfamiliar culture.",132
"Bittoo Boss","Supavitra Babul","Pulkit Samrat, Ashok Pathak, Tanvir Singh, Amita Pathak, Sunil Shetty, Rajendra Sethi, Mohan Kapoor",India,"2020-07-05 00:00:00",2012,TV-14,"Comedies, Dramas, International Movies","When a small-town wedding videographer falls in love, he decides he needs to make more money and turns to shooting sexy videos – with mixed results.",117
Black,"Raja Chanda","Soham Chakraborty, Bidya Sinha Mim, Ashish Vidyarthi, Rajatabha Dutta, Rudranil Ghosh, Kharaj Mukherjee",India,"2020-09-19 00:00:00",2015,TV-14,"Action & Adventure, International Movies","A small-town man takes on a dangerous gangster to avenge his father, a police officer who ended his own life after being framed in a deadly crime.",137
"Black '47","Lance Daly","Hugo Weaving, James Frecheville, Stephen Rea, Freddie Fox, Barry Keoghan, Moe Dunford, Sarah Greene, Jim Broadbent","Ireland, Luxembourg, Belgium","2020-10-24 00:00:00",2018,R,"Action & Adventure, Dramas, Independent Movies","When the Great Famine ravages his beloved country, a battle-hardened Irishman deserts the British Empire and exacts revenge on the tyrants responsible.",100
"Black & Privileged: Volume 1","Mark Harris","Dawnisha Halfkenny, Simeon Henderson, Corey Hendrix, Malcom Banks, Nadia Simms, Brian White, Brely Evans, Cynda Williams, Carl Anthony Payne II","United States","2019-07-12 00:00:00",2019,TV-MA,Dramas,"When low-income families move into a thriving black community in Chicago, they find themselves at odds with politicians to maintain their status.",79
"Black Friday","Anurag Kashyap","Pavan Malhotra, Kay Kay Menon, Aditya Srivastava, Dibyendu Bhattacharya, Kishore Kadam, Gajraj Rao, Zakir Hussain, Imtiaz Ali, Pratima Kazmi, Raj Arjun",India,"2020-11-19 00:00:00",2004,TV-MA,"Dramas, International Movies","This docudrama based on the same-titled book tracks the aftermath of a 1993 bombing in Bombay through the eyes of a journalist covering the story.",162
"Black Hawk Down","Ridley Scott","Josh Hartnett, Ewan McGregor, Tom Sizemore, Eric Bana, William Fichtner, Ewen Bremner, Sam Shepard, Gabriel Casseus, Kim Coates, Hugh Dancy, Ron Eldard, Ioan Gruffudd, Tom Guiry, Charlie Hofheimer, Danny Hoch, Jason Isaacs, Zeljko Ivanek, Glenn Morshower, Jeremy Piven, Brendan Sexton III","United States, United Kingdom","2019-01-01 00:00:00",2001,R,"Action & Adventure, Dramas","When U.S. forces attempt to capture two underlings of a Somali warlord, their helicopters are shot down and the Americans suffer heavy casualties.",144
"Black Man White Skin","Jose Manuel Colón",NULL,Spain,"2016-06-01 00:00:00",2015,TV-PG,"Documentaries, International Movies","This film chronicles the health and social problems that African albinos face and details the fight waged on their behalf by advocacy groups in Spain.",79
"Black Mirror: Bandersnatch",NULL,"Fionn Whitehead, Will Poulter, Craig Parkinson, Alice Lowe, Asim Chaudhry","United States","2018-12-28 00:00:00",2018,TV-MA,"Dramas, International Movies, Sci-Fi & Fantasy","In 1984, a young programmer begins to question reality as he adapts a dark fantasy novel into a video game. A mind-bending tale with multiple endings.",312
"Black Panther","Ryan Coogler","Chadwick Boseman, Michael B. Jordan, Lupita Nyong'o, Danai Gurira, Martin Freeman, Daniel Kaluuya, Letitia Wright, Winston Duke, Sterling K. Brown, Angela Bassett, Forest Whitaker, Andy Serkis, Florence Kasumba, John Kani, David S. Lee, Stan Lee","United States","2018-09-04 00:00:00",2018,PG-13,"Action & Adventure, Sci-Fi & Fantasy","T'Challa, the superpowered new leader of the hidden, highly advanced African nation of Wakanda, strives to protect his home from enemies old and new.",135
"Black Rose","Alexander Nevsky","Alexander Nevsky, Kristanna Loken, Adrian Paul, Robert Davi, Robert Madrid, Matthias Hues, Oksana Sidorenko, Emmanuil Vitorgan, Olga Rodionova, Polina Butorina","Russia, United States","2017-07-02 00:00:00",2014,TV-MA,"Action & Adventure, International Movies","When a number of Russian women are brutally murdered in Los Angeles, the police call on a Moscow detective to help track down the serial killer.",83
"Black Sea","Kevin MacDonald","Jude Law, Scoot McNairy, Ben Mendelsohn, Bobby Schofield, Tobias Menzies, Michael Smiley, Grigoriy Dobrygin, David Threlfall, Jodie Whittaker, Karl Davies","United Kingdom, Russia, United States","2019-02-16 00:00:00",2015,R,"Action & Adventure, Dramas, International Movies","A hard-driving submarine captain is hired to steal gold from a sunken Nazi sub, but there's no honor among thieves during this underwater heist.",114
"Black Site Delta","Jesse Gustafson","Cam Gigandet, Teri Reeves, Michael Dale, Dion Mucciacito, Casey Hendershot, Benjamin Charles Watson, John Brodsky, Arash Mokhtar","United States","2017-08-09 00:00:00",2017,TV-MA,"Action & Adventure","After discovering that their secret military prison is under attack by terrorists, a ragtag group of inmates does their best to neutralize the enemy.",88
"Black Snake Moan","Craig Brewer","Samuel L. Jackson, Christina Ricci, Justin Timberlake, S. Epatha Merkerson, John Cothran, David Banner, Michael Raymond-James, Adriane Lenox, Kim Richards, Neimus K. Williams","United States","2019-11-20 00:00:00",2007,R,"Dramas, Independent Movies","Lazarus finds Rae beaten and near death, and acts as a father figure to help redeem her. But before saving anyone, Lazarus must face his own demons.",116
"Black Snow","Martin Hodara","Ricardo Darín, Leonardo Sbaraglia, Laia Costa, Federico Luppi, Dolores Fonzi, Andrés Herrera","Argentina, Spain","2017-07-01 00:00:00",2017,TV-MA,"Dramas, International Movies, Thrillers","An old tragedy and lingering animosity erupt when a man returns to Patagonia to convince his estranged brother to sell the family's isolated property.",91
Blackfish,"Gabriela Cowperthwaite",NULL,"United States","2020-05-01 00:00:00",2013,PG-13,Documentaries,"This fascinating documentary examines the life of performing killer whale Tilikum, who has caused the deaths of several people while in captivity.",83
"BLACKPINK: Light Up the Sky","Caroline Suh",Blackpink,"United States","2020-10-14 00:00:00",2020,TV-14,"Documentaries, Music & Musicals","Record-shattering Korean girl band BLACKPINK tell their story — and detail the hard-fought journey of the dreams and trials behind their meteoric rise.",80
Blackway,"Daniel Alfredson","Anthony Hopkins, Julia Stiles, Alexander Ludwig, Ray Liotta, Hal Holbrook, Lochlyn Munro, Steve Bacic, Aaron Pearl, Aleks Paunovic","United States","2017-12-15 00:00:00",2015,PG-13,Thrillers,"Menaced by a psychopath who's got the local cops scared, waitress Lillian turns to a mysterious old logger to help her turn the tables on her stalker.",90
BLAME!,"Hiroyuki Seshita","Takahiro Sakurai, Kana Hanazawa, Sora Amamiya, Kazuhiro Yamaji, Mamoru Miyano, Aya Suzaki, Nobunaga Shimazaki, Yuki Kaji, Aki Toyosaki, Saori Hayami",Japan,"2017-05-19 00:00:00",2017,TV-14,"Action & Adventure, Anime Features, International Movies","Inside a vast, self-replicating city bent on eliminating all life, mysterious loner Killy emerges to guide a remnant of humanity desperate to survive.",106
Blaze,"Ethan Hawke","Benjamin Dickey, Alia Shawkat, Josh Hamilton, Charlie Sexton, Sam Rockwell, Wyatt Russell, Steve Zahn, Kris Kristofferson, Richard Linklater, David Kallaway, Ritchie Montgomery","United States","2020-08-30 00:00:00",2018,R,"Dramas, Independent Movies, Music & Musicals","An influential, if unsung country songwriter reflects on his career, and how the love of his life drove him to write his most personal music.",129
"Bleach The Movie: Fade to Black","Noriyuki Abe","Masakazu Morita, Fumiko Orikasa, Aya Hirano, Hiroshi Kamiya, Mitsuaki Madono, Ryotaro Okiayu, Kentaro Ito, Shinichiro Miki, Satsuki Yukino, Masaaki Tsukada",Japan,"2016-10-15 00:00:00",2008,TV-PG,"Action & Adventure, Anime Features, Sci-Fi & Fantasy","When his mind is fogged by a scimitar-weilding stranger, Mayuri destroys his laboratory, unleashing a cloud of reishi that lays waste to the Seiretei.",94
"Bleach the Movie: Hell Verse","Noriyuki Abe","Masakazu Morita, Fumiko Orikasa, Kazuya Nakai, Noriaki Sugiyama, Kentarô Itô, Yuki Matsuoka, Ryotaro Okiayu, Romi Park",Japan,"2016-10-15 00:00:00",2010,TV-14,"Action & Adventure, Anime Features, Sci-Fi & Fantasy","When a group of vicious Sinners plots to escape from this eternal prison in Hell, they discover that Substitute Soul Reaper Ichigo is the key to their freedom. The Sinners launch an attack and in the process kidnap Ichigo's younger sister.",94
"Bleed for This","Ben Younger","Miles Teller, Aaron Eckhart, Katey Sagal, Ciarán Hinds, Ted Levine, Jordan Gelber, Amanda Clayton, Daniel Sauli, Christine Evangelista, Tina Casciani","United States","2020-04-11 00:00:00",2016,R,"Dramas, Sports Movies","After a devastating injury derails his career, scrappy world champion boxer Vinny Pazienza determines to make an against-all-odds comeback.",120
"Blessed Benefit","Mahmoud al Massad","Ahmad Thaher, Maher Khammash, Odai Hijazi, Nadeem Rimawi, Mahmoud al Massad, Nadim Mushahwar","Germany, Jordan, Netherlands","2017-10-13 00:00:00",2016,TV-14,"Comedies, Dramas, International Movies","After being wrongfully convicted of fraud, an honest man finds that life in prison comes with a measure of freedom that is unavailable outside.",83
"Blind Date","Clovis Cornillac","Mélanie Bernier, Clovis Cornillac, Lilou Fogli, Philippe Duquesne, Grégoire Oestermann, Oscar Copp, Boris Terral, Manu Payet",France,"2016-10-15 00:00:00",2015,TV-14,"Comedies, International Movies, Music & Musicals","A passionate pianist and a soulful puzzle maker who treasures silence aren't the best neighbors, but things get interesting when they start to date.",91
"Blind Detective","Johnnie To","Andy Lau, Sammi Cheng, Gao Yuanyuan, Guo Tao, Philip Keung, Lam Suet, Lo Hoi-pang, Tai-Lo Ma, Man-Wai Wong, Ying-Ying Yiu, Yi Zi","Hong Kong, China","2018-12-01 00:00:00",2013,TV-MA,"Action & Adventure, Comedies, International Movies","When a cop loses his vision, his detecting skills stay sharp. Luckily, a rookie officer recognizes his extraordinary powers of deduction.",130
"Blinky Bill: The Movie","Deane Taylor","Ryan Kwanten, Rufus Sewell, Toni Collette, Robin McLeavy, David Wenham, Barry Humphries, Richard Roxburgh, Deborah Mailman, Barry Otto","Australia, United States","2017-02-08 00:00:00",2015,PG,"Children & Family Movies","Happy koala Blinky Bill and some spunky pals travel the Outback following clues to help him find his long-lost father and finally bring him home.",91
