title,director,cast,country,date_added,release_year,rating,listed_in,description,duration_in_minutes
7:19,"Jorge Michel Grau","Demián Bichir, Héctor Bonilla, Oscar Serrano, Azalia Ortiz, Octavio Michel, Carmen Beato",Mexico,"2016-12-23 00:00:00",2016,TV-MA,"Dramas, International Movies","After a devastating earthquake hits Mexico City, trapped survivors from all walks of life wait to be rescued while trying desperately to stay alive.",93
23:59,"Gilbert Chan","Tedd Chan, Stella Chung, Henley Hii, Lawrence Koh, Tommy Kuan, Josh Lai, Mark Lee, Susan Leong, Benjamin Lim",Singapore,"2018-12-20 00:00:00",2011,R,"Horror Movies, International Movies","When an army recruit is found dead, his fellow soldiers are forced to confront a terrifying secret that's haunting their jungle island training camp.",78
9,"Shane Acker","Elijah Wood, John C. Reilly, Jennifer Connelly, Christopher Plummer, Crispin Glover, Martin Landau, Fred Tatasciore, Alan Oppenheimer, Tom Kane","United States","2017-11-16 00:00:00",2009,PG-13,"Action & Adventure, Independent Movies, Sci-Fi & Fantasy","In a postapocalyptic world, rag-doll robots hide in fear from dangerous machines out to exterminate them, until a brave newcomer joins the group.",80
21,"Robert Luketic","Jim Sturgess, Kevin Spacey, Kate Bosworth, Aaron Yoo, Liza Lapira, Jacob Pitts, Laurence Fishburne, Jack McGee, Josh Gad, Sam Golzari, Helen Carey, Jack Gilpin","United States","2020-01-01 00:00:00",2008,PG-13,Dramas,"A brilliant group of students become card-counting experts with the intent of swindling millions out of Las Vegas casinos by playing blackjack.",123
122,"Yasir Al Yasiri","Amina Khalil, Ahmed Dawood, Tarek Lotfy, Ahmed El Fishawy, Mahmoud Hijazi, Jihane Khalil, Asmaa Galal, Tara Emad",Egypt,"2020-06-01 00:00:00",2019,TV-MA,"Horror Movies, International Movies","After an awful accident, a couple admitted to a grisly hospital are separated and must find each other to escape — before death finds them.",95
187,"Kevin Reynolds","Samuel L. Jackson, John Heard, Kelly Rowan, Clifton Collins Jr., Tony Plana","United States","2019-11-01 00:00:00",1997,R,Dramas,"After one of his high school students attacks him, dedicated teacher Trevor Garfield grows weary of the gang warfare in the New York City school system and moves to California to teach there, thinking it must be a less hostile environment.",119
706,"Shravan Kumar","Divya Dutta, Atul Kulkarni, Mohan Agashe, Anupam Shyam, Raayo S. Bakhirta, Yashvit Sancheti, Greeva Kansara, Archan Trivedi, Rajiv Pathak",India,"2019-04-01 00:00:00",2019,TV-14,"Horror Movies, International Movies","When a doctor goes missing, his psychiatrist wife treats the bizarre medical condition of a psychic patient, who knows much more than he's leading on.",118
1920,"Vikram Bhatt","Rajneesh Duggal, Adah Sharma, Indraneil Sengupta, Anjori Alagh, Rajendranath Zutshi, Vipin Sharma, Amin Hajee, Shri Vallabh Vyas",India,"2017-12-15 00:00:00",2008,TV-MA,"Horror Movies, International Movies, Thrillers","An architect and his wife move into a castle that is slated to become a luxury hotel. But something inside is determined to stop the renovation.",143
1922,"Zak Hilditch","Thomas Jane, Molly Parker, Dylan Schmid, Kaitlyn Bernard, Bob Frazer, Brian d'Arcy James, Neal McDonough","United States","2017-10-20 00:00:00",2017,TV-MA,"Dramas, Thrillers","A farmer pens a confession admitting to his wife's murder, but her death is just the beginning of a macabre tale. Based on Stephen King's novella.",103
"2,215","Nottapon Boonprakob","Artiwara Kongmalai",Thailand,"2019-03-01 00:00:00",2018,TV-MA,"Documentaries, International Movies, Sports Movies","This intimate documentary follows rock star Artiwara Kongmalai on his historic, 2,215-kilometer charity run across Thailand in 2017.",89
3022,"John Suits","Omar Epps, Kate Walsh, Miranda Cosgrove, Angus Macfadyen, Jorja Fox, Enver Gjokaj, Haaz Sleiman","United States","2020-03-19 00:00:00",2019,R,"Independent Movies, Sci-Fi & Fantasy, Thrillers","Stranded when the Earth is suddenly destroyed in a mysterious cataclysm, the astronauts aboard a marooned space station slowly lose their minds.",91
Oct-01,"Kunle Afolayan","Sadiq Daba, David Bailie, Kayode Olaiya, Kehinde Bankole, Fabian Adeoye Lojede, Nick Rhys, Kunle Afolayan, Colin David Reese, Ibrahim Shatta, Femi Adebayo, Kanayo O. Kanayo, Lawrence Stubbings, Ademola Adedoyin",Nigeria,"2019-09-01 00:00:00",2014,TV-14,"Dramas, International Movies, Thrillers","Against the backdrop of Nigeria's looming independence from Britain, detective Danladi Waziri races to capture a killer terrorizing local women.",149
22-Jul,"Paul Greengrass","Anders Danielsen Lie, Jon Øigarden, Jonas Strand Gravli, Ola G. Furuseth, Maria Bock, Thorbjørn Harr, Jaden Smith","Norway, Iceland, United States","2018-10-10 00:00:00",2018,R,"Dramas, Thrillers","After devastating terror attacks in Norway, a young survivor, grieving families and the country rally for justice and healing. Based on a true story.",144
15-Aug,"Swapnaneel Jayakar","Rahul Pethe, Mrunmayee Deshpande, Adinath Kothare, Vaibhav Mangale, Jaywant Wadkar, Satish Pulekar, Naina Apte, Uday Tikekar",India,"2019-03-29 00:00:00",2019,TV-14,"Comedies, Dramas, Independent Movies","On India's Independence Day, a zany mishap in a Mumbai chawl disrupts a young love story while compelling the residents to unite in aid of a little boy.",124
'89,NULL,"Lee Dixon, Ian Wright, Paul Merson","United Kingdom","2018-05-16 00:00:00",2017,TV-PG,"Sports Movies","Mixing old footage with interviews, this is the story of Arsenal's improbable win versus Liverpool in the final moments of the 1989 championship game.",87
"​​Kuch Bheege Alfaaz",Onir,"Geetanjali Thapa, Zain Khan Durrani, Shray Rai Tiwari, Mona Ambegaonkar, Chandreyee Ghosh, Barun Chanda, Saheb Bhattacharjee, Shefali Chauhan",India,"2018-09-01 00:00:00",2018,TV-14,"Dramas, Independent Movies, International Movies","After accidentally connecting over the Internet, two strangers form a tight friendship – not knowing they already share a bond.",110
"​Goli Soda 2","Vijay Milton","Samuthirakani, Bharath Seeni, Vinoth, Esakki Barath, Chemban Vinod Jose, Gautham Menon, Krisha Kurup, Subiksha",India,"2018-09-15 00:00:00",2018,TV-14,"Action & Adventure, Dramas, International Movies","A taxi driver, a gangster and an athlete struggle to better their lives despite obstacles like crooked politicians, evil dons and caste barriers.",128
"​Maj Rati ​​Keteki","Santwana Bardoloi","Adil Hussain, Shakil Imtiaz, Mahendra Rabha, Sulakshana Baruah, Rahul Gautam Sarma, Kulada Bhattacharjya, Indu Mohan Das, Moumita Talukdar",India,"2018-09-15 00:00:00",2017,TV-14,"Dramas, International Movies","A successful writer returns to the town that launched his career, encountering people who spark nostalgic, often painfully illuminating flashbacks.",117
​Mayurakshi,"Atanu Ghosh","Soumitra Chatterjee, Prasenjit Chatterjee, Indrani Haldar, Sudipta Chakraborty, Suman Banerjee, Gargi Roychowdhury",India,"2018-09-15 00:00:00",2017,TV-14,"Dramas, International Movies","When a middle-aged divorcee returns to Kolkata to visit his ailing father, long-buried memories resurface, bringing new discoveries with them.",100
(T)ERROR,"Lyric R. Cabral, David Felix Sutcliffe",NULL,"United States","2016-06-30 00:00:00",2015,NR,Documentaries,"This real-life look at FBI counterterrorism operations features access to both sides of a sting: the government informant and the radicalized target.",84
#Alive,"Cho Il","Yoo Ah-in, Park Shin-hye","South Korea","2020-09-08 00:00:00",2020,TV-MA,"Horror Movies, International Movies, Thrillers","As a grisly virus rampages a city, a lone man stays locked inside his apartment, digitally cut off from seeking help and desperate to find a way out.",99
"#AnneFrank - Parallel Stories","Sabina Fedeli, Anna Migotto","Helen Mirren, Gengher Gatti",Italy,"2020-07-01 00:00:00",2019,TV-14,"Documentaries, International Movies","Through her diary, Anne Frank's story is retold alongside those of five Holocaust survivors in this poignant documentary from Oscar winner Helen Mirren.",95
#cats_the_mewvie,"Michael Margolis",NULL,Canada,"2020-02-05 00:00:00",2020,TV-14,"Documentaries, International Movies","This pawesome documentary explores how our feline friends became online icons, from the earliest text memes to the rise of celebrity cat influencers.",90
#FriendButMarried,"Rako Prijanto","Adipati Dolken, Vanesha Prescilla, Rendi Jhon, Beby Tsabina, Denira Wiraguna, Refal Hady, Diandra Agatha, Sari Nila",Indonesia,"2020-05-21 00:00:00",2018,TV-G,"Dramas, International Movies, Romantic Movies","Pining for his high school crush for years, a young man puts up his best efforts to move out of the friend zone until she reveals she's getting married.",102
"#FriendButMarried 2","Rako Prijanto","Adipati Dolken, Mawar de Jongh, Sari Nila, Vonny Cornellya, Clay Gribble, Ivan Leonardy, Sarah Sechan, Jourdy Pranata",Indonesia,"2020-06-28 00:00:00",2020,TV-G,"Dramas, International Movies, Romantic Movies","As Ayu and Ditto finally transition from best friends to newlyweds, a quick pregnancy creates uncertainty for the future of their young marriage.",104
#realityhigh,"Fernando Lebrija","Nesta Cooper, Kate Walsh, John Michael Higgins, Keith Powers, Alicia Sanz, Jake Borelli, Kid Ink, Yousef Erakat, Rebekah Graf, Anne Winters, Peter Gilroy, Patrick Davis","United States","2017-09-08 00:00:00",2017,TV-14,Comedies,"When nerdy high schooler Dani finally attracts the interest of her longtime crush, she lands in the cross hairs of his ex, a social media celebrity.",99
#Roxy,"Michael Kennedy","Jake Short, Sarah Fisher, Booboo Stewart, Danny Trejo, Pippa Mackie, Jake Smith, Patricia Zentilli, Carter Thicke",Canada,"2019-04-10 00:00:00",2018,TV-14,"Comedies, Romantic Movies","A teenage hacker with a huge nose helps a cool kid woo a girl that he’s secretly in love with.",105
#Rucker50,"Robert McCullough Jr.",NULL,"United States","2016-12-01 00:00:00",2016,TV-PG,"Documentaries, Sports Movies","This documentary celebrates the 50th anniversary of the Harlem sports program that has inspired countless city kids to become pro basketball players.",56
#Selfie,"Cristina Jacob","Flavia Hojda, Crina Semciuc, Olimpia Melinte, Levent Sali, Vlad Logigan, Alex Calin, Alina Chivulescu, Razvan Vasilescu",Romania,"2019-06-01 00:00:00",2014,TV-MA,"Comedies, Dramas, International Movies","Two days before their final exams, three teen girls make a seaside getaway to end their adolescence with a bang.",125
"#Selfie 69","Cristina Jacob","Maia Morgenstern, Olimpia Melinte, Crina Semciuc, Flavia Hojda, Maria Dinulescu, Alex Calin, Vlad Logigan, Levent Sali, Silvia Busuioc, Mihaela Mihut",Romania,"2019-06-01 00:00:00",2016,TV-MA,"Comedies, Dramas, International Movies","After a painful breakup, a trio of party-loving friends makes a bet: who can get married in three days.",119
"¡Ay, mi madre!","Frank Ariza","Estefanía de los Santos, Secun de la Rosa, Terele Pávez, María Alfonsa Rosso, Mariola Fuentes, Alfonso Sánchez, Paz Vega, Marta Torné, Concha Galán",Spain,"2019-07-19 00:00:00",2019,TV-MA,"Comedies, International Movies","When her estranged mother suddenly dies, a woman must follow the quirky instructions laid out in the will in order to collect an important inheritance.",81
"Çarsi Pazar","Muharrem Gülmez","Erdem Yener, Ayhan Taş, Emin Olcay, Muharrem Gülmez, Elif Nur Kerkük, Tarık Papuççuoğlu, Suzan Aksoy, Doğa Konakoğlu, Esin Eden, Deniz Özerman",Turkey,"2017-03-10 00:00:00",2015,TV-14,"Comedies, International Movies","The slacker owner of a public bath house rallies his community to save it when a big developer comes to town to close it down and open a new mall.",97
"Ég man þig","Óskar Thór Axelsson","Jóhannes Haukur Jóhannesson, Ágústa Eva Erlendsdóttir, Elma Stefania Agustsdottir, Thor Kristjansson, Anna Gunndís Guðmundsdóttir, Sara Dögg Ásgeirsdóttir, Þröstur Leó Gunnarsson, Jóhann Sigurðarson, Sveinn Geirsson, Arnar Páll Harðarson",Iceland,"2018-03-27 00:00:00",2017,TV-MA,"Horror Movies, International Movies","Young urbanites renovating a rundown house, and a psychiatrist grieving his son's disappearance, are connected to a supernatural, decades-old secret.",106
"Çok Filim Hareketler Bunlar","Ozan Açıktan","Ayça Erturan, Aydan Taş, Ayşegül Akdemir, Burcu Gönder, Bülent Emrah Parlak, Büşra Pekin, Emre Canpolat, Ersin Korkut, Eser Yenenler, Gizem Tuğral, Gülhan Tekin, Gülsüm Alkan, Hamdi Kahraman, İbrahim Büyükak, Metin Keçeci",Turkey,"2017-03-10 00:00:00",2010,TV-MA,"Comedies, International Movies","Vignettes of the summer holidays follow vacationers as they battle mosquitoes, suffer ruined plans and otherwise hit snags in their precious time off.",99
Òlòtūré,"Kenneth Gyang","Beverly Osu, Sharon Ooja, Omowunmi Dada, Pearl Okorie, Wofai Samuel, Ikechukwu Onunaku, Kemi Lala Akindoju, Blossom Chukwujekwu, Adebukola Oladipupo, Omoni Oboli, Segun Arinze, Ada Ameh, Sambasa Nzeribe, Patrick Doyle, Gregory Ojefua",Nigeria,"2020-10-02 00:00:00",2020,TV-MA,"Dramas, International Movies","In Lagos, a journalist goes undercover as a prostitute to expose human trafficking. What she finds is a world of exploited women and ruthless violence.",107
"Æon Flux","Karyn Kusama","Charlize Theron, Marton Csokas, Jonny Lee Miller, Sophie Okonedo, Frances McDormand, Pete Postlethwaite, Amelia Warner, Caroline Chikezie, Nikolai Kinski, Paterson Joseph, Yangzom Brauen","United States","2018-02-01 00:00:00",2005,PG-13,"Action & Adventure, Sci-Fi & Fantasy","Aiming to hasten an uprising, the leader of an underground rebellion dispatches acrobatic assassin Aeon Flux to eliminate the government's top leader.",93
"1 Chance 2 Dance","Adam Deyoe","Lexi Giovagnoli, Justin Ray, Rae Latt, Poonam Basu, Teresa Biter, Kalilah Harris, Alexia Dox, Adam Powell, Sean McBride","United States","2017-07-01 00:00:00",2014,TV-PG,"Dramas, Romantic Movies","When an aspiring dancer is uprooted during her senior year of high school, she finds herself torn between two boys – and with one shot at her dream.",89
"1 Mile to You","Leif Tilden","Billy Crudup, Graham Rogers, Liana Liberato, Stefanie Scott, Tim Roth, Melanie Lynskey, Thomas Cocquerel, Peter Coyote","United States","2017-07-07 00:00:00",2017,TV-14,"Dramas, Romantic Movies, Sports Movies","After escaping the bus accident that killed his girlfriend, a high school student channels his grief into running, with the help of a new coach.",105
"10 Days in Sun City","Adze Ugah","Ayo Makun, Adesua Etomi, Richard Mofe-Damijo, Mercy Johnson, Falz, Tuface Idibia, Thenjiwe Moseley, Motlatsi Mafatshe, Celeste Ntuli, Miguel A. Núñez Jr.","South Africa, Nigeria","2019-10-18 00:00:00",2017,TV-14,"Comedies, International Movies, Romantic Movies","After his girlfriend wins the Miss Nigeria pageant, a young man faces unexpected competition of his own when he joins her on a campaign in South Africa.",87
"10 jours en or","Nicolas Brossette","Franck Dubosc, Claude Rich, Marie Kremer, Mathis Touré, Rufus, Olivier Claverie",France,"2017-07-01 00:00:00",2012,TV-14,"Comedies, Dramas, International Movies","When a carefree bachelor is unexpectedly left in charge of a young boy, the two embark on a road trip that will change both of their lives.",97
"10,000 B.C.","Roland Emmerich","Steven Strait, Camilla Belle, Cliff Curtis, Joel Virgel, Affif Ben Badra, Mo Zinal, Nathanael Baring, Mona Hammond, Omar Sharif","United States, South Africa","2019-06-01 00:00:00",2008,PG-13,"Action & Adventure","Fierce mammoth hunter D'Leh sets out on an impossible journey to rescue the woman he loves from a vicious warlord and save the people of his village.",109
"100 Days Of Solitude",NULL,NULL,Spain,"2018-07-06 00:00:00",2018,TV-MA,"Documentaries, International Movies","Spanish photographer José Díaz spends 100 days living alone on a remote mountain, connecting to nature and documenting the beauty of his surroundings.",93
"100 Meters","Marcel Barrena","Dani Rovira, Karra Elejalde, Alexandra Jiménez, David Verdaguer, Clara Segura, Alba Ribas, Bruno Bergonzini, Ricardo Pereira, Manuela Couto, Marc Balaguer","Portugal, Spain","2017-03-10 00:00:00",2016,TV-MA,"Dramas, International Movies, Sports Movies","A man who is diagnosed with multiple sclerosis responds by training for an Ironman triathlon, with his cranky father-in-law's help.",109
"100 Things to do Before High School",NULL,"Isabela Moner, Jaheem Toombs, Owen Joyner, Jack De Sena, Brady Reiter, Lisa Arch, Stephanie Escajeda","United States","2019-11-02 00:00:00",2014,TV-Y,Movies,"Led by seventh-grader C.J., three students who have been warned about the dangers of high school decide to make the best of their middle-school years.",44
"100 Years: One Woman's Fight for Justice","Melinda Janko",NULL,"United States","2018-03-20 00:00:00",2016,TV-14,Documentaries,"This documentary chronicles Elouise Cobell's long fight against the U.S. government for the gross mismanagement of mineral-rich Native American land.",75
"100% Halal","Jastis Arimba","Anisa Rahma, Ariyo Wahab, Anandito Dwis, Fitria Rasyidi, Arafah Rianti, Kinaryosih",Indonesia,"2021-01-07 00:00:00",2020,TV-14,"Dramas, International Movies","After high school, a young woman marries the man of her father's choice but soon faces the possibility that her religion considers the union invalid.",101
"1000 Rupee Note","Shrihari Sathe","Usha Naik, Sandeep Pathak, Shrikant Yadav, Ganesh Yadav, Pooja Nayak, Devendra Gaikwad",India,"2016-12-01 00:00:00",2014,TV-14,"Dramas, International Movies","After randomly receiving a handsome political bribe, a sweet, poor elderly woman decides to treat herself a shopping spree, which doesn't go smoothly.",89
"12 ROUND GUN","Sam Upton","Sam Upton, Jared Abrahamson, Mark Boone Junior, Laila Ali, Kate Vernon, Cassi Thomson, Colby French, Miguel Perez, Jay Acovone","United States","2019-03-14 00:00:00",2017,TV-MA,"Dramas, Independent Movies, Sports Movies","Dealing with personal demons and the death of his son, a prizefighter attempts a return to the ring by challenging his rival to a 12-round rematch.",90
"13 Cameras","Victor Zarcoff","PJ McCabe, Brianne Moncrief, Sarah Baldwin, Jim Cummings, Heidi Niedermeyer, Neville Archambault","United States","2016-08-13 00:00:00",2015,NR,"Horror Movies, Independent Movies, Thrillers","Young parents-to-be Claire and Ryan move into a suburban rental home, unaware that someone is secretly watching their every move via hidden cameras.",90
"13 Sins","Daniel Stamm","Mark Webber, Rutina Wesley, Devon Graye, Tom Bower, Ron Perlman, Pruitt Taylor Vince","United States","2019-01-13 00:00:00",2014,R,"Horror Movies, Thrillers","A man agrees to appear on a game show with a $6 million prize. But as the challenges become more extreme, he realizes he's made a grave mistake.",93
13TH,"Ava DuVernay",NULL,"United States","2016-10-07 00:00:00",2016,TV-MA,Documentaries,"In this thought-provoking documentary, scholars, activists and politicians analyze the criminalization of African Americans and the U.S. prison boom.",101
"13TH: A Conversation with Oprah Winfrey & Ava DuVernay",NULL,"Oprah Winfrey, Ava DuVernay",NULL,"2017-01-26 00:00:00",2017,NULL,Movies,"Oprah Winfrey sits down with director Ava DuVernay to discuss her Oscar-nominated film, historical cycles of oppression and the broken prison system.",37
"14 Blades","Daniel Lee","Donnie Yen, Zhao Wei, Wu Chun, Law Kar-Ying, Kate Tsui, Yuwu Qi, Wu Ma, Chen Kuan Tai, Sammo Kam-Bo Hung, Chen Zhi Hui, Damian Lau, Xiang Dong Xu","Hong Kong, China, Singapore","2019-04-03 00:00:00",2010,R,"Action & Adventure, International Movies","In the age of the Ming Dynasty, Quinglong is the best of the Jinyiwei, an elite assassin squad made up of highly trained former street urchins. When evil eunuch Jia unseats the emperor, Quinglong is called to action but is quickly betrayed.",113
"14 Cameras","Scott Hussion, Seth Fuller","Neville Archambault, Amber Midthunder, Brytnee Ratledge, Hank Rogerson, Chelsea Edmundson, John-Paul Howard, Lora Martinez-Cunningham, Brianne Moncrief","United States","2018-10-27 00:00:00",2018,TV-MA,"Horror Movies, Thrillers","Upping the “13 Cameras” ante, this sequel finds a family renting a vacation house that’s been customized to violate their privacy.",89
"14 Minutes from Earth","Adam Davis, Jerry Kolber, Trey Nelson, Erich Sturm",NULL,"United States","2019-02-01 00:00:00",2016,TV-MA,Documentaries,"A Google executive boldly attempts a death-defying mission to travel to space and free-fall back to Earth without a rocket.",84
"16 Blocks","Richard Donner","Bruce Willis, Mos Def, David Morse, Jenna Stern, Cylk Cozart, Casey Sander, David Zayas, Robert Racki, Patrick Garrow, Sasha Roiz","United States, Germany","2019-11-01 00:00:00",2006,PG-13,"Action & Adventure","Tasked with escorting a prosecution witness to court, an aging cop gears up for the 16-block trek – but they'll be lucky to make it there alive.",102
"17 Again","Burr Steers","Zac Efron, Leslie Mann, Matthew Perry, Thomas Lennon, Michelle Trachtenberg, Melora Hardin, Sterling Knight, Hunter Parrish, Nicole Sullivan, Allison Miller","United States","2021-01-01 00:00:00",2009,PG-13,Comedies,"Nearing a midlife crisis, thirty-something Mike wishes for a "do-over" – and that's exactly what he gets when he wakes up to find he's 17 again.",102
"18 Presents","Francesco Amato","Vittoria Puccini, Benedetta Porcaroli, Edoardo Leo, Sara Lazzaro, Marco Messeri, Betty Pedrazzi, Alessandro Giallocosta, Filippo Gili, Giacomo Rosselli",Italy,"2020-05-08 00:00:00",2020,TV-MA,"Dramas, Independent Movies, International Movies","A pregnant mother with terminal cancer leaves behind 18 sentimental gifts for her unborn daughter to receive every birthday until she reaches womanhood.",114
"1898: Our Last Men in the Philippines","Salvador Calvo","Luis Tosar, Javier Gutiérrez, Álvaro Cervantes, Karra Elejalde, Carlos Hipólito, Ricardo Gómez, Patrick Criado, Eduard Fernández, Miguel Herrán, Emilio Palacios",Spain,"2017-06-02 00:00:00",2016,R,"Dramas, International Movies","While Spain relinquishes its last colonies, a battle-fatigued outpost engages in a long, brutal and sometimes bizarre clash with Filipino insurgents.",130
1BR,"David Marmor","Nicole Brydon Bloom, Giles Matthey, Taylor Nichols, Alan Blumenfeld, Celeste Sully, Susan Davis, Clayton Hoff, Earnestine Phillips","United States","2020-08-23 00:00:00",2019,TV-MA,"Horror Movies, Independent Movies, Thrillers","Seeking her independence, a young woman moves to Los Angeles and settles into a cozy apartment complex with a disturbing sense of community.",90
"1st Summoning","Raymond Wood","Hayley Lovitt, Teddy Cole, Brook Todd, Ace Harney, Jason Macdonald","United States","2019-07-26 00:00:00",2018,TV-MA,"Horror Movies, Independent Movies","Student filmmakers uncover occult rituals tied to an abandoned warehouse, then gradually realize the horror is closer than they think.",94
"2 Alone in Paris","Ramzy Bedia, Éric Judor","Ramzy Bedia, Éric Judor, Benoît Magimel, Kristin Scott Thomas, Élodie Bouchez, Édouard Baer, Fred Testot, Omar Sy",France,"2020-06-01 00:00:00",2008,TV-MA,"Comedies, International Movies","A bumbling Paris policeman is doggedly determined to capture the master thief that repeatedly eludes him, even when they're the last two men on Earth.",97
"2 States","Abhishek Varman","Alia Bhatt, Arjun Kapoor, Ronit Roy, Amrita Singh, Revathy, Aru Krishansh Verma",India,"2018-08-04 00:00:00",2014,TV-PG,"Comedies, Dramas, International Movies","Graduate students Krish and Ananya hope to win their parents' approval before they marry, but the two families clash over their cultural differences.",143
"20 Feet From Stardom","Morgan Neville","Darlene Love, Merry Clayton, Lisa Fischer, Táta Vega, Claudia Lennear, Judith Hill, Bruce Springsteen, Mick Jagger, Stevie Wonder, Sting, Bette Midler, Cissy Houston, Sheryl Crow, Tata Vega","United States","2018-09-22 00:00:00",2013,PG-13,"Documentaries, Music & Musicals","Winner of the 2014 Academy Award for Best Documentary Feature, this film takes a look at the world of backup vocalists and the legends they support.",91
"2015 Dream Concert",NULL,"4Minute, B1A4, BtoB, ELSIE, EXID, EXO, Got7, INFINITE, KARA, Shinee, Sistar, VIXX, Nine Muses, BTS, Secret, Topp Dogg","South Korea","2017-04-28 00:00:00",2015,TV-PG,"International Movies, Music & Musicals","The world's biggest K-pop festival marked its 21st year in 2015, with groups such as EXO, 4Minute and SHINee electrifying the Seoul World Cup Stadium.",107
"2036 Origin Unknown","Hasraf Dulull","Katee Sackhoff, Ray Fearon, Julie Cox, Steven Cree, David Tse, Joe David Walters","United Kingdom","2018-12-20 00:00:00",2018,TV-14,"Sci-Fi & Fantasy","Working with an artificial intelligence to investigate the failure of a deadly Mars landing, a mission controller makes an astonishing discovery.",95
"20th Century Women","Mike Mills","Annette Bening, Elle Fanning, Greta Gerwig, Lucas Jade Zumann, Billy Crudup","United States","2019-06-28 00:00:00",2016,R,"Dramas, Independent Movies","In 1979, single bohemian mom Dorothea, hoping to help her teen son find his place as a man, asks two young women to share their lives with him.",119
"21 & Over","Jon Lucas, Scott Moore","Miles Teller, Skylar Astin, Justin Chon, Sarah Wright, Jonathan Keltz, François Chau, Russell Hodgkinson, Daniel Booko, Russell Mercado, Josie Loren, Dustin Ybarra","United States","2019-04-16 00:00:00",2013,R,Comedies,"Jeff's straight-and-narrow life changes abruptly when his buddies take him out for a birthday bash – the night before a crucial med school interview.",93
